#
# Test that we can store JSON arrays in histogram field mysql.column_stats when histogram_type=JSON
#
set @SINGLE_PREC_TYPE='single_prec_hb';
set @DOUBLE_PREC_TYPE='double_prec_hb';
set @DEFAULT_HIST_TYPE=@@histogram_type;
set @SINGLE_PREC_TYPE='JSON';
set @DOUBLE_PREC_TYPE='JSON';
set @DEFAULT_HIST_TYPE='JSON';
drop table if exists t1,t2;
set @save_use_stat_tables=@@use_stat_tables;
set @save_histogram_size=@@global.histogram_size;
set @@global.histogram_size=0,@@local.histogram_size=0;
set @save_hist_type=@DEFAULT_HIST_TYPE;
set histogram_type=@SINGLE_PREC_TYPE;
DELETE FROM mysql.table_stats;
DELETE FROM mysql.column_stats;
DELETE FROM mysql.index_stats;
set use_stat_tables='preferably';
CREATE TABLE t1 (
a int NOT NULL PRIMARY KEY,
b varchar(32),
c char(16),
d date,
e double,
f bit(3),
INDEX idx1 (b, e), 
INDEX idx2 (c, d),
INDEX idx3 (d),
INDEX idx4 (e, b, d)
) ENGINE= MYISAM;
INSERT INTO t1 VALUES
(0, NULL, NULL, NULL, NULL, NULL),
(7, 'xxxxxxxxxxxxxxxxxxxxxxxxxx', 'dddddddd', '1990-05-15', 0.1, b'100'),
(17, 'vvvvvvvvvvvvv', 'aaaa', '1989-03-12', 0.01, b'101'),
(1, 'vvvvvvvvvvvvv', NULL, '1989-03-12', 0.01, b'100'),
(12, 'wwwwwwwwwwwwwwwwwwwwwwwwwwww', 'dddddddd', '1999-07-23', 0.112, b'001'),
(23, 'vvvvvvvvvvvvv', 'dddddddd', '1999-07-23', 0.1, b'100'),
(8, 'vvvvvvvvvvvvv', 'aaaa', '1999-07-23', 0.1, b'100'),
(22, 'xxxxxxxxxxxxxxxxxxxxxxxxxx', 'aaaa', '1989-03-12', 0.112, b'001'),
(31, 'wwwwwwwwwwwwwwwwwwwwwwwwwwww', 'aaaa', '1999-07-23', 0.01, b'001'),
(10, NULL, 'aaaa', NULL, 0.01, b'010'),
(5, 'wwwwwwwwwwwwwwwwwwwwwwwwwwww', 'dddddddd', '1999-07-23', 0.1, b'100'),
(15, 'vvvvvvvvvvvvv', 'ccccccccc', '1990-05-15', 0.1, b'010'),
(30, NULL, 'bbbbbb', NULL, NULL, b'100'),
(38, 'zzzzzzzzzzzzzzzzzz', 'bbbbbb', NULL, NULL, NULL),
(18, 'zzzzzzzzzzzzzzzzzz', 'ccccccccc', '1990-05-15', 0.01, b'010'),
(9, 'yyy', 'bbbbbb', '1998-08-28', 0.01, NULL),
(29, 'vvvvvvvvvvvvv', 'dddddddd', '1999-07-23', 0.012, b'010'),
(3, 'yyy', 'dddddddd',  '1990-05-15', 0.112, b'010'),
(39, 'zzzzzzzzzzzzzzzzzz', 'bbbbbb', NULL, 0.01, b'100'),
(14, 'xxxxxxxxxxxxxxxxxxxxxxxxxx', 'ccccccccc', '1990-05-15', 0.1, b'100'),
(40, 'zzzzzzzzzzzzzzzzzz', 'bbbbbb', '1989-03-12', NULL, NULL),
(44, NULL, 'aaaa', '1989-03-12', NULL, b'010'),
(19, 'vvvvvvvvvvvvv', 'ccccccccc', '1990-05-15', 0.012, b'011'),
(21, 'zzzzzzzzzzzzzzzzzz', 'dddddddd', '1989-03-12', 0.112, b'100'),
(45, NULL, NULL, '1989-03-12', NULL, b'011'),
(2, 'wwwwwwwwwwwwwwwwwwwwwwwwwwww', 'ccccccccc', '1990-05-15', 0.1, b'001'),
(35, 'yyy', 'aaaa', '1990-05-15', 0.05, b'011'),
(4, 'vvvvvvvvvvvvv', 'dddddddd', '1999-07-23', 0.01, b'101'),
(47, NULL, 'aaaa', '1990-05-15', 0.05, b'010'),
(42, NULL, 'ccccccccc', '1989-03-12', 0.01, b'010'),
(32, NULL, 'bbbbbb', '1990-05-15', 0.01, b'011'),
(49, 'wwwwwwwwwwwwwwwwwwwwwwwwwwww' , 'aaaa', '1990-05-15', NULL, NULL),
(43, 'wwwwwwwwwwwwwwwwwwwwwwwwwwww' , 'bbbbbb', '1990-05-15', NULL, b'100'),
(37, 'yyy', NULL, '1989-03-12', 0.05, b'011'),
(41, 'xxxxxxxxxxxxxxxxxxxxxxxxxx', 'ccccccccc', '1990-05-15', 0.05, NULL),
(34, 'yyy', NULL, NULL, NULL, NULL),
(33, 'zzzzzzzzzzzzzzzzzz', 'dddddddd', '1989-03-12', 0.05, b'011'),
(24,  'wwwwwwwwwwwwwwwwwwwwwwwwwwww', 'dddddddd', '1990-05-15', 0.01,  b'101'),
(11, 'yyy', 'ccccccccc', '1999-07-23', 0.1, NULL),
(25, 'zzzzzzzzzzzzzzzzzz', 'bbb', '1989-03-12', 0.01,  b'101');
ANALYZE TABLE t1;
Table	Op	Msg_type	Msg_text
test.t1	analyze	status	Engine-independent statistics collected
test.t1	analyze	status	OK
SELECT * FROM mysql.table_stats;
db_name	table_name	cardinality
test	t1	40
SELECT * FROM mysql.column_stats;
db_name	table_name	column_name	min_value	max_value	nulls_ratio	avg_length	avg_frequency	hist_size	hist_type	histogram
test	t1	a	0	49	0.0000	4.0000	1.0000	0	NULL	NULL
test	t1	b	vvvvvvvvvvvvv	zzzzzzzzzzzzzzzzzz	0.2000	17.1250	6.4000	0	NULL	NULL
test	t1	c	aaaa	dddddddd	0.1250	6.6571	7.0000	0	NULL	NULL
test	t1	d	1989-03-12	1999-07-23	0.1500	3.0000	8.5000	0	NULL	NULL
test	t1	e	0.01	0.112	0.2250	8.0000	6.2000	0	NULL	NULL
test	t1	f	1	5	0.2000	1.0000	6.4000	0	NULL	NULL
SELECT * FROM mysql.index_stats;
db_name	table_name	index_name	prefix_arity	avg_frequency
test	t1	PRIMARY	1	1.0000
test	t1	idx1	1	6.4000
test	t1	idx1	2	1.6875
test	t1	idx2	1	7.0000
test	t1	idx2	2	2.3846
test	t1	idx3	1	8.5000
test	t1	idx4	1	6.2000
test	t1	idx4	2	1.6875
test	t1	idx4	3	1.1304
SELECT COUNT(*) FROM t1;
COUNT(*)
40
SELECT * FROM mysql.column_stats
WHERE db_name='test' AND table_name='t1' AND column_name='a';
db_name	table_name	column_name	min_value	max_value	nulls_ratio	avg_length	avg_frequency	hist_size	hist_type	histogram
test	t1	a	0	49	0.0000	4.0000	1.0000	0	NULL	NULL
SELECT MIN(t1.a), MAX(t1.a), 
(SELECT COUNT(*) FROM t1 WHERE t1.b IS NULL) /
(SELECT COUNT(*) FROM t1) AS "NULLS_RATIO(t1.a)",
(SELECT COUNT(t1.a) FROM t1) /
(SELECT COUNT(DISTINCT t1.a) FROM t1) AS "AVG_FREQUENCY(t1.a)"
FROM t1;
MIN(t1.a)	MAX(t1.a)	NULLS_RATIO(t1.a)	AVG_FREQUENCY(t1.a)
0	49	0.2000	1.0000
SELECT * FROM mysql.column_stats
WHERE db_name='test' AND table_name='t1' AND column_name='b';
db_name	table_name	column_name	min_value	max_value	nulls_ratio	avg_length	avg_frequency	hist_size	hist_type	histogram
test	t1	b	vvvvvvvvvvvvv	zzzzzzzzzzzzzzzzzz	0.2000	17.1250	6.4000	0	NULL	NULL
SELECT MIN(t1.b), MAX(t1.b), 
(SELECT COUNT(*) FROM t1 WHERE t1.b IS NULL) /
(SELECT COUNT(*) FROM t1) AS "NULLS_RATIO(t1.b)",
(SELECT COUNT(t1.b) FROM t1) /
(SELECT COUNT(DISTINCT t1.b) FROM t1) AS "AVG_FREQUENCY(t1.b)"
FROM t1;
MIN(t1.b)	MAX(t1.b)	NULLS_RATIO(t1.b)	AVG_FREQUENCY(t1.b)
vvvvvvvvvvvvv	zzzzzzzzzzzzzzzzzz	0.2000	6.4000
SELECT * FROM mysql.column_stats 
WHERE db_name='test' AND table_name='t1' AND column_name='c';
db_name	table_name	column_name	min_value	max_value	nulls_ratio	avg_length	avg_frequency	hist_size	hist_type	histogram
test	t1	c	aaaa	dddddddd	0.1250	6.6571	7.0000	0	NULL	NULL
SELECT MIN(t1.c), MAX(t1.c), 
(SELECT COUNT(*) FROM t1 WHERE t1.c IS NULL) /
(SELECT COUNT(*) FROM t1) AS "NULLS_RATIO(t1.c)",
(SELECT COUNT(t1.c) FROM t1) /
(SELECT COUNT(DISTINCT t1.c) FROM t1) AS "AVG_FREQUENCY(t1.c)"
FROM t1;
MIN(t1.c)	MAX(t1.c)	NULLS_RATIO(t1.c)	AVG_FREQUENCY(t1.c)
aaaa	dddddddd	0.1250	7.0000
SELECT * FROM mysql.column_stats
WHERE db_name='test' AND table_name='t1' AND column_name='d';
db_name	table_name	column_name	min_value	max_value	nulls_ratio	avg_length	avg_frequency	hist_size	hist_type	histogram
test	t1	d	1989-03-12	1999-07-23	0.1500	3.0000	8.5000	0	NULL	NULL
SELECT MIN(t1.d), MAX(t1.d), 
(SELECT COUNT(*) FROM t1 WHERE t1.d IS NULL) /
(SELECT COUNT(*) FROM t1) AS "NULLS_RATIO(t1.d)",
(SELECT COUNT(t1.d) FROM t1) /
(SELECT COUNT(DISTINCT t1.d) FROM t1) AS "AVG_FREQUENCY(t1.d)"
FROM t1;
MIN(t1.d)	MAX(t1.d)	NULLS_RATIO(t1.d)	AVG_FREQUENCY(t1.d)
1989-03-12	1999-07-23	0.1500	8.5000
SELECT * FROM mysql.column_stats
WHERE db_name='test' AND table_name='t1' AND column_name='e';
db_name	table_name	column_name	min_value	max_value	nulls_ratio	avg_length	avg_frequency	hist_size	hist_type	histogram
test	t1	e	0.01	0.112	0.2250	8.0000	6.2000	0	NULL	NULL
SELECT MIN(t1.e), MAX(t1.e), 
(SELECT COUNT(*) FROM t1 WHERE t1.e IS NULL) /
(SELECT COUNT(*) FROM t1) AS "NULLS_RATIO(t1.e)",
(SELECT COUNT(t1.e) FROM t1) /
(SELECT COUNT(DISTINCT t1.e) FROM t1) AS "AVG_FREQUENCY(t1.e)"
FROM t1;
MIN(t1.e)	MAX(t1.e)	NULLS_RATIO(t1.e)	AVG_FREQUENCY(t1.e)
0.01	0.112	0.2250	6.2000
SELECT * FROM mysql.index_stats
WHERE db_name='test' AND table_name='t1' AND index_name='idx1';
db_name	table_name	index_name	prefix_arity	avg_frequency
test	t1	idx1	1	6.4000
test	t1	idx1	2	1.6875
SELECT 
(SELECT COUNT(*) FROM t1 WHERE t1.b IS NOT NULL) /
(SELECT COUNT(DISTINCT t1.b) FROM t1 WHERE t1.b IS NOT NULL)
AS 'ARITY 1',
(SELECT COUNT(*) FROM t1 WHERE t1.b IS NOT NULL AND t1.e IS NOT NULL) /
(SELECT COUNT(DISTINCT t1.b, t1.e) FROM t1
WHERE t1.b IS NOT NULL AND t1.e IS NOT NULL) 
AS 'ARITY 2';
ARITY 1	ARITY 2
6.4000	1.6875
SELECT * FROM mysql.index_stats
WHERE db_name='test' AND table_name='t1' AND index_name='idx2';
db_name	table_name	index_name	prefix_arity	avg_frequency
test	t1	idx2	1	7.0000
test	t1	idx2	2	2.3846
SELECT 
(SELECT COUNT(*) FROM t1 WHERE t1.c IS NOT NULL) /
(SELECT COUNT(DISTINCT t1.c) FROM t1 WHERE t1.c IS NOT NULL) 
AS 'ARITY 1',
(SELECT COUNT(*) FROM t1 WHERE t1.c IS NOT NULL AND t1.d IS NOT NULL) /
(SELECT COUNT(DISTINCT t1.c, t1.d) FROM t1
WHERE t1.c IS NOT NULL AND t1.d IS NOT NULL)
AS 'ARITY 2';
ARITY 1	ARITY 2
7.0000	2.3846
SELECT * FROM mysql.index_stats
WHERE db_name='test' AND table_name='t1' AND index_name='idx3';
db_name	table_name	index_name	prefix_arity	avg_frequency
test	t1	idx3	1	8.5000
SELECT 
(SELECT COUNT(*) FROM t1 WHERE t1.d IS NOT NULL) /
(SELECT COUNT(DISTINCT t1.d) FROM t1 WHERE t1.d IS NOT NULL)
AS 'ARITY 1';
ARITY 1
8.5000
SELECT * FROM mysql.index_stats
WHERE db_name='test' AND table_name='t1' AND index_name='idx4';
db_name	table_name	index_name	prefix_arity	avg_frequency
test	t1	idx4	1	6.2000
test	t1	idx4	2	1.6875
test	t1	idx4	3	1.1304
SELECT 
(SELECT COUNT(*) FROM t1 WHERE t1.e IS NOT NULL) /
(SELECT COUNT(DISTINCT t1.e) FROM t1 WHERE t1.e IS NOT NULL)
AS 'ARITY 1',
(SELECT COUNT(*) FROM t1 WHERE t1.e IS NOT NULL AND t1.b IS NOT NULL) /
(SELECT COUNT(DISTINCT t1.e, t1.b) FROM t1
WHERE t1.e IS NOT NULL AND t1.b IS NOT NULL)
AS 'ARITY 2',
(SELECT COUNT(*) FROM t1
WHERE t1.e IS NOT NULL AND t1.b IS NOT NULL AND t1.d IS NOT NULL) /  
(SELECT COUNT(DISTINCT t1.e, t1.b, t1.d) FROM t1
WHERE t1.e IS NOT NULL AND t1.b IS NOT NULL AND t1.d IS NOT NULL)
AS 'ARITY 3';
ARITY 1	ARITY 2	ARITY 3
6.2000	1.6875	1.1304
DELETE FROM mysql.column_stats;
set histogram_size=4;
ANALYZE TABLE t1;
Table	Op	Msg_type	Msg_text
test.t1	analyze	status	Engine-independent statistics collected
test.t1	analyze	status	Table is already up to date
SELECT db_name, table_name, column_name,
min_value, max_value,
nulls_ratio, avg_frequency,
hist_size, hist_type, HEX(histogram)
FROM mysql.column_stats;
db_name	table_name	column_name	min_value	max_value	nulls_ratio	avg_frequency	hist_size	hist_type	HEX(histogram)
test	t1	a	0	49	0.0000	1.0000	4	JSON	5B0A20202230222C0A2020223135222C0A2020223333222C0A2020223439220A5D
test	t1	b	vvvvvvvvvvvvv	zzzzzzzzzzzzzzzzzz	0.2000	6.4000	4	JSON	5B0A20202276767676767676767676767676222C0A20202277777777777777777777777777777777777777777777777777777777222C0A202022797979222C0A2020227A7A7A7A7A7A7A7A7A7A7A7A7A7A7A7A7A7A220A5D
test	t1	c	aaaa	dddddddd	0.1250	7.0000	4	JSON	5B0A20202261616161222C0A202022626262626262222C0A202022636363636363636363222C0A2020226464646464646464220A5D
test	t1	d	1989-03-12	1999-07-23	0.1500	8.5000	4	JSON	5B0A202022313938392D30332D3132222C0A202022313939302D30352D3135222C0A202022313939302D30352D3135222C0A202022313939392D30372D3233220A5D
test	t1	e	0.01	0.112	0.2250	6.2000	4	JSON	5B0A202022302E3031222C0A202022302E3031222C0A202022302E31222C0A202022302E313132220A5D
test	t1	f	1	5	0.2000	6.4000	4	JSON	5B0A20202201222C0A20202202222C0A20202204222C0A20202205220A5D
DELETE FROM mysql.column_stats;
set histogram_size=8;
set histogram_type=@DOUBLE_PREC_TYPE;
ANALYZE TABLE t1;
Table	Op	Msg_type	Msg_text
test.t1	analyze	status	Engine-independent statistics collected
test.t1	analyze	status	Table is already up to date
SELECT db_name, table_name, column_name,
min_value, max_value,
nulls_ratio, avg_frequency,
hist_size, hist_type, HEX(histogram)
FROM mysql.column_stats;
db_name	table_name	column_name	min_value	max_value	nulls_ratio	avg_frequency	hist_size	hist_type	HEX(histogram)
test	t1	a	0	49	0.0000	1.0000	8	JSON	5B0A20202230222C0A20202235222C0A2020223132222C0A2020223231222C0A2020223239222C0A2020223335222C0A2020223432222C0A2020223439220A5D
test	t1	b	vvvvvvvvvvvvv	zzzzzzzzzzzzzzzzzz	0.2000	6.4000	7	JSON	5B0A20202276767676767676767676767676222C0A20202276767676767676767676767676222C0A20202277777777777777777777777777777777777777777777777777777777222C0A20202277777777777777777777777777777777777777777777777777777777222C0A2020227878787878787878787878787878787878787878787878787878222C0A202022797979222C0A2020227A7A7A7A7A7A7A7A7A7A7A7A7A7A7A7A7A7A220A5D
test	t1	c	aaaa	dddddddd	0.1250	7.0000	7	JSON	5B0A20202261616161222C0A20202261616161222C0A202022626262626262222C0A202022626262626262222C0A202022636363636363636363222C0A2020226464646464646464222C0A2020226464646464646464220A5D
test	t1	d	1989-03-12	1999-07-23	0.1500	8.5000	7	JSON	5B0A202022313938392D30332D3132222C0A202022313938392D30332D3132222C0A202022313938392D30332D3132222C0A202022313939302D30352D3135222C0A202022313939302D30352D3135222C0A202022313939302D30352D3135222C0A202022313939392D30372D3233220A5D
test	t1	e	0.01	0.112	0.2250	6.2000	8	JSON	5B0A202022302E3031222C0A202022302E3031222C0A202022302E3031222C0A202022302E303132222C0A202022302E3035222C0A202022302E31222C0A202022302E31222C0A202022302E313132220A5D
test	t1	f	1	5	0.2000	6.4000	8	JSON	5B0A20202201222C0A20202202222C0A20202202222C0A20202203222C0A20202204222C0A20202204222C0A20202204222C0A20202205220A5D
DELETE FROM mysql.column_stats;
set histogram_size= 0;
set histogram_type=@SINGLE_PREC_TYPE;
ANALYZE TABLE t1;
Table	Op	Msg_type	Msg_text
test.t1	analyze	status	Engine-independent statistics collected
test.t1	analyze	status	Table is already up to date
CREATE TABLE t3 (
a int NOT NULL PRIMARY KEY,
b varchar(32),
c char(16),
INDEX idx (c)
) ENGINE=MYISAM;
INSERT INTO t3 VALUES
(0, NULL, NULL),
(7, 'xxxxxxxxxxxxxxxxxxxxxxxxxx', 'dddddddd'),
(17, 'vvvvvvvvvvvvv', 'aaaa'),
(1, 'vvvvvvvvvvvvv', NULL),
(12, 'wwwwwwwwwwwwwwwwwwwwwwwwwwww', 'dddddddd'),
(23, 'vvvvvvvvvvvvv', 'dddddddd'),
(8, 'vvvvvvvvvvvvv', 'aaaa'),
(22, 'xxxxxxxxxxxxxxxxxxxxxxxxxx', 'aaaa'),
(31, 'wwwwwwwwwwwwwwwwwwwwwwwwwwww', 'aaaa'),
(10, NULL, 'aaaa'),
(5, 'wwwwwwwwwwwwwwwwwwwwwwwwwwww', 'dddddddd'),
(15, 'vvvvvvvvvvvvv', 'ccccccccc'),
(30, NULL, 'bbbbbb'),
(38, 'zzzzzzzzzzzzzzzzzz', 'bbbbbb'),
(18, 'zzzzzzzzzzzzzzzzzz', 'ccccccccc'),
(9, 'yyy', 'bbbbbb'),
(29, 'vvvvvvvvvvvvv', 'dddddddd');
ANALYZE TABLE t3;
Table	Op	Msg_type	Msg_text
test.t3	analyze	status	Engine-independent statistics collected
test.t3	analyze	status	OK
SELECT * FROM mysql.table_stats;
db_name	table_name	cardinality
test	t1	40
test	t3	17
SELECT * FROM mysql.column_stats;
db_name	table_name	column_name	min_value	max_value	nulls_ratio	avg_length	avg_frequency	hist_size	hist_type	histogram
test	t1	a	0	49	0.0000	4.0000	1.0000	0	NULL	NULL
test	t1	b	vvvvvvvvvvvvv	zzzzzzzzzzzzzzzzzz	0.2000	17.1250	6.4000	0	NULL	NULL
test	t1	c	aaaa	dddddddd	0.1250	6.6571	7.0000	0	NULL	NULL
test	t1	d	1989-03-12	1999-07-23	0.1500	3.0000	8.5000	0	NULL	NULL
test	t1	e	0.01	0.112	0.2250	8.0000	6.2000	0	NULL	NULL
test	t1	f	1	5	0.2000	1.0000	6.4000	0	NULL	NULL
test	t3	a	0	38	0.0000	4.0000	1.0000	0	NULL	NULL
test	t3	b	vvvvvvvvvvvvv	zzzzzzzzzzzzzzzzzz	0.1765	18.0714	2.8000	0	NULL	NULL
test	t3	c	aaaa	dddddddd	0.1176	6.4000	3.7500	0	NULL	NULL
SELECT * FROM mysql.index_stats;
db_name	table_name	index_name	prefix_arity	avg_frequency
test	t1	PRIMARY	1	1.0000
test	t1	idx1	1	6.4000
test	t1	idx1	2	1.6875
test	t1	idx2	1	7.0000
test	t1	idx2	2	2.3846
test	t1	idx3	1	8.5000
test	t1	idx4	1	6.2000
test	t1	idx4	2	1.6875
test	t1	idx4	3	1.1304
test	t3	PRIMARY	1	1.0000
test	t3	idx	1	3.7500
ALTER TABLE t1 RENAME TO s1;
SELECT * FROM mysql.table_stats;
db_name	table_name	cardinality
test	s1	40
test	t3	17
SELECT * FROM mysql.column_stats;
db_name	table_name	column_name	min_value	max_value	nulls_ratio	avg_length	avg_frequency	hist_size	hist_type	histogram
test	s1	a	0	49	0.0000	4.0000	1.0000	0	NULL	NULL
test	s1	b	vvvvvvvvvvvvv	zzzzzzzzzzzzzzzzzz	0.2000	17.1250	6.4000	0	NULL	NULL
test	s1	c	aaaa	dddddddd	0.1250	6.6571	7.0000	0	NULL	NULL
test	s1	d	1989-03-12	1999-07-23	0.1500	3.0000	8.5000	0	NULL	NULL
test	s1	e	0.01	0.112	0.2250	8.0000	6.2000	0	NULL	NULL
test	s1	f	1	5	0.2000	1.0000	6.4000	0	NULL	NULL
test	t3	a	0	38	0.0000	4.0000	1.0000	0	NULL	NULL
test	t3	b	vvvvvvvvvvvvv	zzzzzzzzzzzzzzzzzz	0.1765	18.0714	2.8000	0	NULL	NULL
test	t3	c	aaaa	dddddddd	0.1176	6.4000	3.7500	0	NULL	NULL
SELECT * FROM mysql.index_stats;
db_name	table_name	index_name	prefix_arity	avg_frequency
test	s1	PRIMARY	1	1.0000
test	s1	idx1	1	6.4000
test	s1	idx1	2	1.6875
test	s1	idx2	1	7.0000
test	s1	idx2	2	2.3846
test	s1	idx3	1	8.5000
test	s1	idx4	1	6.2000
test	s1	idx4	2	1.6875
test	s1	idx4	3	1.1304
test	t3	PRIMARY	1	1.0000
test	t3	idx	1	3.7500
RENAME TABLE s1 TO t1;
SELECT * FROM mysql.table_stats;
db_name	table_name	cardinality
test	t1	40
test	t3	17
SELECT * FROM mysql.column_stats;
db_name	table_name	column_name	min_value	max_value	nulls_ratio	avg_length	avg_frequency	hist_size	hist_type	histogram
test	t1	a	0	49	0.0000	4.0000	1.0000	0	NULL	NULL
test	t1	b	vvvvvvvvvvvvv	zzzzzzzzzzzzzzzzzz	0.2000	17.1250	6.4000	0	NULL	NULL
test	t1	c	aaaa	dddddddd	0.1250	6.6571	7.0000	0	NULL	NULL
test	t1	d	1989-03-12	1999-07-23	0.1500	3.0000	8.5000	0	NULL	NULL
test	t1	e	0.01	0.112	0.2250	8.0000	6.2000	0	NULL	NULL
test	t1	f	1	5	0.2000	1.0000	6.4000	0	NULL	NULL
test	t3	a	0	38	0.0000	4.0000	1.0000	0	NULL	NULL
test	t3	b	vvvvvvvvvvvvv	zzzzzzzzzzzzzzzzzz	0.1765	18.0714	2.8000	0	NULL	NULL
test	t3	c	aaaa	dddddddd	0.1176	6.4000	3.7500	0	NULL	NULL
SELECT * FROM mysql.index_stats;
db_name	table_name	index_name	prefix_arity	avg_frequency
test	t1	PRIMARY	1	1.0000
test	t1	idx1	1	6.4000
test	t1	idx1	2	1.6875
test	t1	idx2	1	7.0000
test	t1	idx2	2	2.3846
test	t1	idx3	1	8.5000
test	t1	idx4	1	6.2000
test	t1	idx4	2	1.6875
test	t1	idx4	3	1.1304
test	t3	PRIMARY	1	1.0000
test	t3	idx	1	3.7500
DROP TABLE t3;
SELECT * FROM mysql.table_stats;
db_name	table_name	cardinality
test	t1	40
SELECT * FROM mysql.column_stats;
db_name	table_name	column_name	min_value	max_value	nulls_ratio	avg_length	avg_frequency	hist_size	hist_type	histogram
test	t1	a	0	49	0.0000	4.0000	1.0000	0	NULL	NULL
test	t1	b	vvvvvvvvvvvvv	zzzzzzzzzzzzzzzzzz	0.2000	17.1250	6.4000	0	NULL	NULL
test	t1	c	aaaa	dddddddd	0.1250	6.6571	7.0000	0	NULL	NULL
test	t1	d	1989-03-12	1999-07-23	0.1500	3.0000	8.5000	0	NULL	NULL
test	t1	e	0.01	0.112	0.2250	8.0000	6.2000	0	NULL	NULL
test	t1	f	1	5	0.2000	1.0000	6.4000	0	NULL	NULL
SELECT * FROM mysql.index_stats;
db_name	table_name	index_name	prefix_arity	avg_frequency
test	t1	PRIMARY	1	1.0000
test	t1	idx1	1	6.4000
test	t1	idx1	2	1.6875
test	t1	idx2	1	7.0000
test	t1	idx2	2	2.3846
test	t1	idx3	1	8.5000
test	t1	idx4	1	6.2000
test	t1	idx4	2	1.6875
test	t1	idx4	3	1.1304
CREATE TEMPORARY TABLE t0 (
a int NOT NULL PRIMARY KEY,
b varchar(32)
);
INSERT INTO t0 SELECT a,b FROM t1;
ALTER TABLE t1 CHANGE COLUMN b x varchar(32), 
CHANGE COLUMN e y double;
SHOW CREATE TABLE t1;
Table	Create Table
t1	CREATE TABLE `t1` (
  `a` int(11) NOT NULL,
  `x` varchar(32) DEFAULT NULL,
  `c` char(16) DEFAULT NULL,
  `d` date DEFAULT NULL,
  `y` double DEFAULT NULL,
  `f` bit(3) DEFAULT NULL,
  PRIMARY KEY (`a`),
  KEY `idx1` (`x`,`y`),
  KEY `idx2` (`c`,`d`),
  KEY `idx3` (`d`),
  KEY `idx4` (`y`,`x`,`d`)
) ENGINE=MyISAM DEFAULT CHARSET=latin1
SELECT * FROM mysql.column_stats;
db_name	table_name	column_name	min_value	max_value	nulls_ratio	avg_length	avg_frequency	hist_size	hist_type	histogram
test	t1	a	0	49	0.0000	4.0000	1.0000	0	NULL	NULL
test	t1	c	aaaa	dddddddd	0.1250	6.6571	7.0000	0	NULL	NULL
test	t1	d	1989-03-12	1999-07-23	0.1500	3.0000	8.5000	0	NULL	NULL
test	t1	f	1	5	0.2000	1.0000	6.4000	0	NULL	NULL
test	t1	x	vvvvvvvvvvvvv	zzzzzzzzzzzzzzzzzz	0.2000	17.1250	6.4000	0	NULL	NULL
test	t1	y	0.01	0.112	0.2250	8.0000	6.2000	0	NULL	NULL
ALTER TABLE t1 CHANGE COLUMN x b varchar(32), 
CHANGE COLUMN y e double;
SHOW CREATE TABLE t1;
Table	Create Table
t1	CREATE TABLE `t1` (
  `a` int(11) NOT NULL,
  `b` varchar(32) DEFAULT NULL,
  `c` char(16) DEFAULT NULL,
  `d` date DEFAULT NULL,
  `e` double DEFAULT NULL,
  `f` bit(3) DEFAULT NULL,
  PRIMARY KEY (`a`),
  KEY `idx1` (`b`,`e`),
  KEY `idx2` (`c`,`d`),
  KEY `idx3` (`d`),
  KEY `idx4` (`e`,`b`,`d`)
) ENGINE=MyISAM DEFAULT CHARSET=latin1
SELECT * FROM mysql.column_stats;
db_name	table_name	column_name	min_value	max_value	nulls_ratio	avg_length	avg_frequency	hist_size	hist_type	histogram
test	t1	a	0	49	0.0000	4.0000	1.0000	0	NULL	NULL
test	t1	b	vvvvvvvvvvvvv	zzzzzzzzzzzzzzzzzz	0.2000	17.1250	6.4000	0	NULL	NULL
test	t1	c	aaaa	dddddddd	0.1250	6.6571	7.0000	0	NULL	NULL
test	t1	d	1989-03-12	1999-07-23	0.1500	3.0000	8.5000	0	NULL	NULL
test	t1	e	0.01	0.112	0.2250	8.0000	6.2000	0	NULL	NULL
test	t1	f	1	5	0.2000	1.0000	6.4000	0	NULL	NULL
ALTER TABLE t1 RENAME TO s1, CHANGE COLUMN b x varchar(32);
SHOW CREATE TABLE s1;
Table	Create Table
s1	CREATE TABLE `s1` (
  `a` int(11) NOT NULL,
  `x` varchar(32) DEFAULT NULL,
  `c` char(16) DEFAULT NULL,
  `d` date DEFAULT NULL,
  `e` double DEFAULT NULL,
  `f` bit(3) DEFAULT NULL,
  PRIMARY KEY (`a`),
  KEY `idx1` (`x`,`e`),
  KEY `idx2` (`c`,`d`),
  KEY `idx3` (`d`),
  KEY `idx4` (`e`,`x`,`d`)
) ENGINE=MyISAM DEFAULT CHARSET=latin1
SELECT * FROM mysql.table_stats;
db_name	table_name	cardinality
test	s1	40
SELECT * FROM mysql.column_stats;
db_name	table_name	column_name	min_value	max_value	nulls_ratio	avg_length	avg_frequency	hist_size	hist_type	histogram
test	s1	a	0	49	0.0000	4.0000	1.0000	0	NULL	NULL
test	s1	c	aaaa	dddddddd	0.1250	6.6571	7.0000	0	NULL	NULL
test	s1	d	1989-03-12	1999-07-23	0.1500	3.0000	8.5000	0	NULL	NULL
test	s1	e	0.01	0.112	0.2250	8.0000	6.2000	0	NULL	NULL
test	s1	f	1	5	0.2000	1.0000	6.4000	0	NULL	NULL
test	s1	x	vvvvvvvvvvvvv	zzzzzzzzzzzzzzzzzz	0.2000	17.1250	6.4000	0	NULL	NULL
SELECT * FROM mysql.index_stats;
db_name	table_name	index_name	prefix_arity	avg_frequency
test	s1	PRIMARY	1	1.0000
test	s1	idx1	1	6.4000
test	s1	idx1	2	1.6875
test	s1	idx2	1	7.0000
test	s1	idx2	2	2.3846
test	s1	idx3	1	8.5000
test	s1	idx4	1	6.2000
test	s1	idx4	2	1.6875
test	s1	idx4	3	1.1304
ALTER TABLE s1 RENAME TO t1, CHANGE COLUMN x b varchar(32);
SHOW CREATE TABLE t1;
Table	Create Table
t1	CREATE TABLE `t1` (
  `a` int(11) NOT NULL,
  `b` varchar(32) DEFAULT NULL,
  `c` char(16) DEFAULT NULL,
  `d` date DEFAULT NULL,
  `e` double DEFAULT NULL,
  `f` bit(3) DEFAULT NULL,
  PRIMARY KEY (`a`),
  KEY `idx1` (`b`,`e`),
  KEY `idx2` (`c`,`d`),
  KEY `idx3` (`d`),
  KEY `idx4` (`e`,`b`,`d`)
) ENGINE=MyISAM DEFAULT CHARSET=latin1
SELECT * FROM mysql.table_stats;
db_name	table_name	cardinality
test	t1	40
SELECT * FROM mysql.column_stats;
db_name	table_name	column_name	min_value	max_value	nulls_ratio	avg_length	avg_frequency	hist_size	hist_type	histogram
test	t1	a	0	49	0.0000	4.0000	1.0000	0	NULL	NULL
test	t1	b	vvvvvvvvvvvvv	zzzzzzzzzzzzzzzzzz	0.2000	17.1250	6.4000	0	NULL	NULL
test	t1	c	aaaa	dddddddd	0.1250	6.6571	7.0000	0	NULL	NULL
test	t1	d	1989-03-12	1999-07-23	0.1500	3.0000	8.5000	0	NULL	NULL
test	t1	e	0.01	0.112	0.2250	8.0000	6.2000	0	NULL	NULL
test	t1	f	1	5	0.2000	1.0000	6.4000	0	NULL	NULL
SELECT * FROM mysql.index_stats;
db_name	table_name	index_name	prefix_arity	avg_frequency
test	t1	PRIMARY	1	1.0000
test	t1	idx1	1	6.4000
test	t1	idx1	2	1.6875
test	t1	idx2	1	7.0000
test	t1	idx2	2	2.3846
test	t1	idx3	1	8.5000
test	t1	idx4	1	6.2000
test	t1	idx4	2	1.6875
test	t1	idx4	3	1.1304
ALTER TABLE t1 CHANGE COLUMN b x varchar(30);
SHOW CREATE TABLE t1;
Table	Create Table
t1	CREATE TABLE `t1` (
  `a` int(11) NOT NULL,
  `x` varchar(30) DEFAULT NULL,
  `c` char(16) DEFAULT NULL,
  `d` date DEFAULT NULL,
  `e` double DEFAULT NULL,
  `f` bit(3) DEFAULT NULL,
  PRIMARY KEY (`a`),
  KEY `idx1` (`x`,`e`),
  KEY `idx2` (`c`,`d`),
  KEY `idx3` (`d`),
  KEY `idx4` (`e`,`x`,`d`)
) ENGINE=MyISAM DEFAULT CHARSET=latin1
SELECT * FROM mysql.column_stats;
db_name	table_name	column_name	min_value	max_value	nulls_ratio	avg_length	avg_frequency	hist_size	hist_type	histogram
test	t1	a	0	49	0.0000	4.0000	1.0000	0	NULL	NULL
test	t1	c	aaaa	dddddddd	0.1250	6.6571	7.0000	0	NULL	NULL
test	t1	d	1989-03-12	1999-07-23	0.1500	3.0000	8.5000	0	NULL	NULL
test	t1	e	0.01	0.112	0.2250	8.0000	6.2000	0	NULL	NULL
test	t1	f	1	5	0.2000	1.0000	6.4000	0	NULL	NULL
SELECT * FROM mysql.index_stats;
db_name	table_name	index_name	prefix_arity	avg_frequency
test	t1	PRIMARY	1	1.0000
test	t1	idx2	1	7.0000
test	t1	idx2	2	2.3846
test	t1	idx3	1	8.5000
ALTER TABLE t1 CHANGE COLUMN x b varchar(32);
SHOW CREATE TABLE t1;
Table	Create Table
t1	CREATE TABLE `t1` (
  `a` int(11) NOT NULL,
  `b` varchar(32) DEFAULT NULL,
  `c` char(16) DEFAULT NULL,
  `d` date DEFAULT NULL,
  `e` double DEFAULT NULL,
  `f` bit(3) DEFAULT NULL,
  PRIMARY KEY (`a`),
  KEY `idx1` (`b`,`e`),
  KEY `idx2` (`c`,`d`),
  KEY `idx3` (`d`),
  KEY `idx4` (`e`,`b`,`d`)
) ENGINE=MyISAM DEFAULT CHARSET=latin1
SELECT * FROM mysql.column_stats;
db_name	table_name	column_name	min_value	max_value	nulls_ratio	avg_length	avg_frequency	hist_size	hist_type	histogram
test	t1	a	0	49	0.0000	4.0000	1.0000	0	NULL	NULL
test	t1	c	aaaa	dddddddd	0.1250	6.6571	7.0000	0	NULL	NULL
test	t1	d	1989-03-12	1999-07-23	0.1500	3.0000	8.5000	0	NULL	NULL
test	t1	e	0.01	0.112	0.2250	8.0000	6.2000	0	NULL	NULL
test	t1	f	1	5	0.2000	1.0000	6.4000	0	NULL	NULL
SELECT * FROM mysql.index_stats;
db_name	table_name	index_name	prefix_arity	avg_frequency
test	t1	PRIMARY	1	1.0000
test	t1	idx2	1	7.0000
test	t1	idx2	2	2.3846
test	t1	idx3	1	8.5000
ANALYZE TABLE t1 PERSISTENT FOR COLUMNS(b) INDEXES(idx1, idx4);
Table	Op	Msg_type	Msg_text
test.t1	analyze	status	Engine-independent statistics collected
test.t1	analyze	status	OK
SELECT * FROM mysql.column_stats;
db_name	table_name	column_name	min_value	max_value	nulls_ratio	avg_length	avg_frequency	hist_size	hist_type	histogram
test	t1	a	0	49	0.0000	4.0000	1.0000	0	NULL	NULL
test	t1	b	vvvvvvvvvvvvv	zzzzzzzzzzzzzzzzzz	0.2000	17.1250	6.4000	0	NULL	NULL
test	t1	c	aaaa	dddddddd	0.1250	6.6571	7.0000	0	NULL	NULL
test	t1	d	1989-03-12	1999-07-23	0.1500	3.0000	8.5000	0	NULL	NULL
test	t1	e	0.01	0.112	0.2250	8.0000	6.2000	0	NULL	NULL
test	t1	f	1	5	0.2000	1.0000	6.4000	0	NULL	NULL
SELECT * FROM mysql.index_stats;
db_name	table_name	index_name	prefix_arity	avg_frequency
test	t1	PRIMARY	1	1.0000
test	t1	idx1	1	6.4000
test	t1	idx1	2	1.6875
test	t1	idx2	1	7.0000
test	t1	idx2	2	2.3846
test	t1	idx3	1	8.5000
test	t1	idx4	1	6.2000
test	t1	idx4	2	1.6875
test	t1	idx4	3	1.1304
SELECT * INTO OUTFILE 'MYSQLTEST_VARDIR/tmp/save_column_stats'
  FIELDS TERMINATED BY ',' OPTIONALLY ENCLOSED BY '"' LINES TERMINATED BY '\n'
  FROM mysql.column_stats WHERE column_name='b';
SELECT * INTO OUTFILE 'MYSQLTEST_VARDIR/tmp/save_index_stats'
  FIELDS TERMINATED BY ',' OPTIONALLY ENCLOSED BY '"' LINES TERMINATED BY '\n'
  FROM mysql.index_stats WHERE index_name IN ('idx1', 'idx4');
ALTER TABLE t1 CHANGE COLUMN b x varchar(30);
SHOW CREATE TABLE t1;
Table	Create Table
t1	CREATE TABLE `t1` (
  `a` int(11) NOT NULL,
  `x` varchar(30) DEFAULT NULL,
  `c` char(16) DEFAULT NULL,
  `d` date DEFAULT NULL,
  `e` double DEFAULT NULL,
  `f` bit(3) DEFAULT NULL,
  PRIMARY KEY (`a`),
  KEY `idx1` (`x`,`e`),
  KEY `idx2` (`c`,`d`),
  KEY `idx3` (`d`),
  KEY `idx4` (`e`,`x`,`d`)
) ENGINE=MyISAM DEFAULT CHARSET=latin1
SELECT * FROM mysql.column_stats;
db_name	table_name	column_name	min_value	max_value	nulls_ratio	avg_length	avg_frequency	hist_size	hist_type	histogram
test	t1	a	0	49	0.0000	4.0000	1.0000	0	NULL	NULL
test	t1	c	aaaa	dddddddd	0.1250	6.6571	7.0000	0	NULL	NULL
test	t1	d	1989-03-12	1999-07-23	0.1500	3.0000	8.5000	0	NULL	NULL
test	t1	e	0.01	0.112	0.2250	8.0000	6.2000	0	NULL	NULL
test	t1	f	1	5	0.2000	1.0000	6.4000	0	NULL	NULL
SELECT * FROM mysql.index_stats;
db_name	table_name	index_name	prefix_arity	avg_frequency
test	t1	PRIMARY	1	1.0000
test	t1	idx2	1	7.0000
test	t1	idx2	2	2.3846
test	t1	idx3	1	8.5000
ALTER TABLE t1 CHANGE COLUMN x b varchar(32);
SHOW CREATE TABLE t1;
Table	Create Table
t1	CREATE TABLE `t1` (
  `a` int(11) NOT NULL,
  `b` varchar(32) DEFAULT NULL,
  `c` char(16) DEFAULT NULL,
  `d` date DEFAULT NULL,
  `e` double DEFAULT NULL,
  `f` bit(3) DEFAULT NULL,
  PRIMARY KEY (`a`),
  KEY `idx1` (`b`,`e`),
  KEY `idx2` (`c`,`d`),
  KEY `idx3` (`d`),
  KEY `idx4` (`e`,`b`,`d`)
) ENGINE=MyISAM DEFAULT CHARSET=latin1
SELECT * FROM mysql.column_stats;
db_name	table_name	column_name	min_value	max_value	nulls_ratio	avg_length	avg_frequency	hist_size	hist_type	histogram
test	t1	a	0	49	0.0000	4.0000	1.0000	0	NULL	NULL
test	t1	c	aaaa	dddddddd	0.1250	6.6571	7.0000	0	NULL	NULL
test	t1	d	1989-03-12	1999-07-23	0.1500	3.0000	8.5000	0	NULL	NULL
test	t1	e	0.01	0.112	0.2250	8.0000	6.2000	0	NULL	NULL
test	t1	f	1	5	0.2000	1.0000	6.4000	0	NULL	NULL
SELECT * FROM mysql.index_stats;
db_name	table_name	index_name	prefix_arity	avg_frequency
test	t1	PRIMARY	1	1.0000
test	t1	idx2	1	7.0000
test	t1	idx2	2	2.3846
test	t1	idx3	1	8.5000
LOAD DATA INFILE 'MYSQLTEST_VARDIR/tmp/save_column_stats'
  INTO TABLE mysql.column_stats
FIELDS TERMINATED BY ',' OPTIONALLY ENCLOSED BY '"' LINES TERMINATED BY '\n';
LOAD DATA INFILE 'MYSQLTEST_VARDIR/tmp/save_index_stats'
  INTO TABLE mysql.index_stats
FIELDS TERMINATED BY ',' OPTIONALLY ENCLOSED BY '"' LINES TERMINATED BY '\n';
SELECT * FROM mysql.column_stats;
db_name	table_name	column_name	min_value	max_value	nulls_ratio	avg_length	avg_frequency	hist_size	hist_type	histogram
test	t1	a	0	49	0.0000	4.0000	1.0000	0	NULL	NULL
test	t1	b	vvvvvvvvvvvvv	zzzzzzzzzzzzzzzzzz	0.2000	17.1250	6.4000	0	NULL	NULL
test	t1	c	aaaa	dddddddd	0.1250	6.6571	7.0000	0	NULL	NULL
test	t1	d	1989-03-12	1999-07-23	0.1500	3.0000	8.5000	0	NULL	NULL
test	t1	e	0.01	0.112	0.2250	8.0000	6.2000	0	NULL	NULL
test	t1	f	1	5	0.2000	1.0000	6.4000	0	NULL	NULL
SELECT * FROM mysql.index_stats;
db_name	table_name	index_name	prefix_arity	avg_frequency
test	t1	PRIMARY	1	1.0000
test	t1	idx1	1	6.4000
test	t1	idx1	2	1.6875
test	t1	idx2	1	7.0000
test	t1	idx2	2	2.3846
test	t1	idx3	1	8.5000
test	t1	idx4	1	6.2000
test	t1	idx4	2	1.6875
test	t1	idx4	3	1.1304
ALTER TABLE t1 DROP COLUMN b;
SHOW CREATE TABLE t1;
Table	Create Table
t1	CREATE TABLE `t1` (
  `a` int(11) NOT NULL,
  `c` char(16) DEFAULT NULL,
  `d` date DEFAULT NULL,
  `e` double DEFAULT NULL,
  `f` bit(3) DEFAULT NULL,
  PRIMARY KEY (`a`),
  KEY `idx1` (`e`),
  KEY `idx2` (`c`,`d`),
  KEY `idx3` (`d`),
  KEY `idx4` (`e`,`d`)
) ENGINE=MyISAM DEFAULT CHARSET=latin1
SELECT * FROM mysql.column_stats;
db_name	table_name	column_name	min_value	max_value	nulls_ratio	avg_length	avg_frequency	hist_size	hist_type	histogram
test	t1	a	0	49	0.0000	4.0000	1.0000	0	NULL	NULL
test	t1	c	aaaa	dddddddd	0.1250	6.6571	7.0000	0	NULL	NULL
test	t1	d	1989-03-12	1999-07-23	0.1500	3.0000	8.5000	0	NULL	NULL
test	t1	e	0.01	0.112	0.2250	8.0000	6.2000	0	NULL	NULL
test	t1	f	1	5	0.2000	1.0000	6.4000	0	NULL	NULL
SELECT * FROM mysql.index_stats;
db_name	table_name	index_name	prefix_arity	avg_frequency
test	t1	PRIMARY	1	1.0000
test	t1	idx2	1	7.0000
test	t1	idx2	2	2.3846
test	t1	idx3	1	8.5000
DROP INDEX idx2 ON t1;
SHOW CREATE TABLE t1;
Table	Create Table
t1	CREATE TABLE `t1` (
  `a` int(11) NOT NULL,
  `c` char(16) DEFAULT NULL,
  `d` date DEFAULT NULL,
  `e` double DEFAULT NULL,
  `f` bit(3) DEFAULT NULL,
  PRIMARY KEY (`a`),
  KEY `idx1` (`e`),
  KEY `idx3` (`d`),
  KEY `idx4` (`e`,`d`)
) ENGINE=MyISAM DEFAULT CHARSET=latin1
SELECT * FROM mysql.index_stats;
db_name	table_name	index_name	prefix_arity	avg_frequency
test	t1	PRIMARY	1	1.0000
test	t1	idx3	1	8.5000
DROP INDEX idx1 ON t1;
DROP INDEX idx4 ON t1;
SHOW CREATE TABLE t1;
Table	Create Table
t1	CREATE TABLE `t1` (
  `a` int(11) NOT NULL,
  `c` char(16) DEFAULT NULL,
  `d` date DEFAULT NULL,
  `e` double DEFAULT NULL,
  `f` bit(3) DEFAULT NULL,
  PRIMARY KEY (`a`),
  KEY `idx3` (`d`)
) ENGINE=MyISAM DEFAULT CHARSET=latin1
ALTER TABLE t1 ADD COLUMN b varchar(32);
CREATE INDEX idx1 ON t1(b, e);
CREATE INDEX idx2 ON t1(c, d);
CREATE INDEX idx4 ON t1(e, b, d);
SHOW CREATE TABLE t1;
Table	Create Table
t1	CREATE TABLE `t1` (
  `a` int(11) NOT NULL,
  `c` char(16) DEFAULT NULL,
  `d` date DEFAULT NULL,
  `e` double DEFAULT NULL,
  `f` bit(3) DEFAULT NULL,
  `b` varchar(32) DEFAULT NULL,
  PRIMARY KEY (`a`),
  KEY `idx3` (`d`),
  KEY `idx1` (`b`,`e`),
  KEY `idx2` (`c`,`d`),
  KEY `idx4` (`e`,`b`,`d`)
) ENGINE=MyISAM DEFAULT CHARSET=latin1
SELECT * FROM mysql.column_stats;
db_name	table_name	column_name	min_value	max_value	nulls_ratio	avg_length	avg_frequency	hist_size	hist_type	histogram
test	t1	a	0	49	0.0000	4.0000	1.0000	0	NULL	NULL
test	t1	c	aaaa	dddddddd	0.1250	6.6571	7.0000	0	NULL	NULL
test	t1	d	1989-03-12	1999-07-23	0.1500	3.0000	8.5000	0	NULL	NULL
test	t1	e	0.01	0.112	0.2250	8.0000	6.2000	0	NULL	NULL
test	t1	f	1	5	0.2000	1.0000	6.4000	0	NULL	NULL
SELECT * FROM mysql.index_stats;
db_name	table_name	index_name	prefix_arity	avg_frequency
test	t1	PRIMARY	1	1.0000
test	t1	idx3	1	8.5000
ANALYZE TABLE t1 PERSISTENT FOR COLUMNS(b) INDEXES(idx1, idx2, idx4);
Table	Op	Msg_type	Msg_text
test.t1	analyze	status	Engine-independent statistics collected
test.t1	analyze	status	OK
SELECT * FROM mysql.column_stats;
db_name	table_name	column_name	min_value	max_value	nulls_ratio	avg_length	avg_frequency	hist_size	hist_type	histogram
test	t1	a	0	49	0.0000	4.0000	1.0000	0	NULL	NULL
test	t1	b	NULL	NULL	1.0000	NULL	NULL	0	NULL	NULL
test	t1	c	aaaa	dddddddd	0.1250	6.6571	7.0000	0	NULL	NULL
test	t1	d	1989-03-12	1999-07-23	0.1500	3.0000	8.5000	0	NULL	NULL
test	t1	e	0.01	0.112	0.2250	8.0000	6.2000	0	NULL	NULL
test	t1	f	1	5	0.2000	1.0000	6.4000	0	NULL	NULL
SELECT * FROM mysql.index_stats;
db_name	table_name	index_name	prefix_arity	avg_frequency
test	t1	PRIMARY	1	1.0000
test	t1	idx1	1	NULL
test	t1	idx1	2	NULL
test	t1	idx2	1	7.0000
test	t1	idx2	2	2.3846
test	t1	idx3	1	8.5000
test	t1	idx4	1	6.2000
test	t1	idx4	2	NULL
test	t1	idx4	3	NULL
UPDATE t1 SET b=(SELECT b FROM t0 WHERE t0.a= t1.a);
ANALYZE TABLE t1 PERSISTENT FOR COLUMNS(b) INDEXES(idx1, idx2, idx4);
Table	Op	Msg_type	Msg_text
test.t1	analyze	status	Engine-independent statistics collected
test.t1	analyze	status	OK
SELECT * FROM mysql.column_stats;
db_name	table_name	column_name	min_value	max_value	nulls_ratio	avg_length	avg_frequency	hist_size	hist_type	histogram
test	t1	a	0	49	0.0000	4.0000	1.0000	0	NULL	NULL
test	t1	b	vvvvvvvvvvvvv	zzzzzzzzzzzzzzzzzz	0.2000	17.1250	6.4000	0	NULL	NULL
test	t1	c	aaaa	dddddddd	0.1250	6.6571	7.0000	0	NULL	NULL
test	t1	d	1989-03-12	1999-07-23	0.1500	3.0000	8.5000	0	NULL	NULL
test	t1	e	0.01	0.112	0.2250	8.0000	6.2000	0	NULL	NULL
test	t1	f	1	5	0.2000	1.0000	6.4000	0	NULL	NULL
SELECT * FROM mysql.index_stats;
db_name	table_name	index_name	prefix_arity	avg_frequency
test	t1	PRIMARY	1	1.0000
test	t1	idx1	1	6.4000
test	t1	idx1	2	1.6875
test	t1	idx2	1	7.0000
test	t1	idx2	2	2.3846
test	t1	idx3	1	8.5000
test	t1	idx4	1	6.2000
test	t1	idx4	2	1.6875
test	t1	idx4	3	1.1304
ALTER TABLE t1 DROP COLUMN b,
DROP INDEX idx1, DROP INDEX idx2, DROP INDEX idx4;
SHOW CREATE TABLE t1;
Table	Create Table
t1	CREATE TABLE `t1` (
  `a` int(11) NOT NULL,
  `c` char(16) DEFAULT NULL,
  `d` date DEFAULT NULL,
  `e` double DEFAULT NULL,
  `f` bit(3) DEFAULT NULL,
  PRIMARY KEY (`a`),
  KEY `idx3` (`d`)
) ENGINE=MyISAM DEFAULT CHARSET=latin1
SELECT * FROM mysql.column_stats;
db_name	table_name	column_name	min_value	max_value	nulls_ratio	avg_length	avg_frequency	hist_size	hist_type	histogram
test	t1	a	0	49	0.0000	4.0000	1.0000	0	NULL	NULL
test	t1	c	aaaa	dddddddd	0.1250	6.6571	7.0000	0	NULL	NULL
test	t1	d	1989-03-12	1999-07-23	0.1500	3.0000	8.5000	0	NULL	NULL
test	t1	e	0.01	0.112	0.2250	8.0000	6.2000	0	NULL	NULL
test	t1	f	1	5	0.2000	1.0000	6.4000	0	NULL	NULL
SELECT * FROM mysql.index_stats;
db_name	table_name	index_name	prefix_arity	avg_frequency
test	t1	PRIMARY	1	1.0000
test	t1	idx3	1	8.5000
ALTER TABLE t1 ADD COLUMN b varchar(32);
ALTER TABLE t1 
ADD INDEX idx1 (b, e), ADD INDEX idx2 (c, d), ADD INDEX idx4 (e, b, d);
UPDATE t1 SET b=(SELECT b FROM t0 WHERE t0.a= t1.a);
SHOW CREATE TABLE t1;
Table	Create Table
t1	CREATE TABLE `t1` (
  `a` int(11) NOT NULL,
  `c` char(16) DEFAULT NULL,
  `d` date DEFAULT NULL,
  `e` double DEFAULT NULL,
  `f` bit(3) DEFAULT NULL,
  `b` varchar(32) DEFAULT NULL,
  PRIMARY KEY (`a`),
  KEY `idx3` (`d`),
  KEY `idx1` (`b`,`e`),
  KEY `idx2` (`c`,`d`),
  KEY `idx4` (`e`,`b`,`d`)
) ENGINE=MyISAM DEFAULT CHARSET=latin1
SELECT * FROM mysql.column_stats;
db_name	table_name	column_name	min_value	max_value	nulls_ratio	avg_length	avg_frequency	hist_size	hist_type	histogram
test	t1	a	0	49	0.0000	4.0000	1.0000	0	NULL	NULL
test	t1	c	aaaa	dddddddd	0.1250	6.6571	7.0000	0	NULL	NULL
test	t1	d	1989-03-12	1999-07-23	0.1500	3.0000	8.5000	0	NULL	NULL
test	t1	e	0.01	0.112	0.2250	8.0000	6.2000	0	NULL	NULL
test	t1	f	1	5	0.2000	1.0000	6.4000	0	NULL	NULL
SELECT * FROM mysql.index_stats;
db_name	table_name	index_name	prefix_arity	avg_frequency
test	t1	PRIMARY	1	1.0000
test	t1	idx3	1	8.5000
ANALYZE TABLE t1 PERSISTENT FOR COLUMNS(b) INDEXES(idx1, idx2, idx4);
Table	Op	Msg_type	Msg_text
test.t1	analyze	status	Engine-independent statistics collected
test.t1	analyze	status	OK
SELECT * FROM mysql.column_stats;
db_name	table_name	column_name	min_value	max_value	nulls_ratio	avg_length	avg_frequency	hist_size	hist_type	histogram
test	t1	a	0	49	0.0000	4.0000	1.0000	0	NULL	NULL
test	t1	b	vvvvvvvvvvvvv	zzzzzzzzzzzzzzzzzz	0.2000	17.1250	6.4000	0	NULL	NULL
test	t1	c	aaaa	dddddddd	0.1250	6.6571	7.0000	0	NULL	NULL
test	t1	d	1989-03-12	1999-07-23	0.1500	3.0000	8.5000	0	NULL	NULL
test	t1	e	0.01	0.112	0.2250	8.0000	6.2000	0	NULL	NULL
test	t1	f	1	5	0.2000	1.0000	6.4000	0	NULL	NULL
SELECT * FROM mysql.index_stats;
db_name	table_name	index_name	prefix_arity	avg_frequency
test	t1	PRIMARY	1	1.0000
test	t1	idx1	1	6.4000
test	t1	idx1	2	1.6875
test	t1	idx2	1	7.0000
test	t1	idx2	2	2.3846
test	t1	idx3	1	8.5000
test	t1	idx4	1	6.2000
test	t1	idx4	2	1.6875
test	t1	idx4	3	1.1304
DELETE FROM mysql.table_stats;
DELETE FROM mysql.column_stats;
DELETE FROM mysql.index_stats;
ANALYZE TABLE t1 PERSISTENT FOR COLUMNS() INDEXES();
Table	Op	Msg_type	Msg_text
test.t1	analyze	status	Engine-independent statistics collected
test.t1	analyze	status	Table is already up to date
SELECT * FROM mysql.table_stats;
db_name	table_name	cardinality
test	t1	40
SELECT * FROM mysql.column_stats;
db_name	table_name	column_name	min_value	max_value	nulls_ratio	avg_length	avg_frequency	hist_size	hist_type	histogram
SELECT * FROM mysql.index_stats;
db_name	table_name	index_name	prefix_arity	avg_frequency
ANALYZE TABLE t1 PERSISTENT FOR COLUMNS(c,e,b) INDEXES(idx2,idx4);
Table	Op	Msg_type	Msg_text
test.t1	analyze	status	Engine-independent statistics collected
test.t1	analyze	status	Table is already up to date
SELECT * FROM mysql.table_stats;
db_name	table_name	cardinality
test	t1	40
SELECT * FROM mysql.column_stats;
db_name	table_name	column_name	min_value	max_value	nulls_ratio	avg_length	avg_frequency	hist_size	hist_type	histogram
test	t1	b	vvvvvvvvvvvvv	zzzzzzzzzzzzzzzzzz	0.2000	17.1250	6.4000	0	NULL	NULL
test	t1	c	aaaa	dddddddd	0.1250	6.6571	7.0000	0	NULL	NULL
test	t1	e	0.01	0.112	0.2250	8.0000	6.2000	0	NULL	NULL
SELECT * FROM mysql.index_stats;
db_name	table_name	index_name	prefix_arity	avg_frequency
test	t1	idx2	1	7.0000
test	t1	idx2	2	2.3846
test	t1	idx4	1	6.2000
test	t1	idx4	2	1.6875
test	t1	idx4	3	1.1304
DELETE FROM mysql.index_stats WHERE table_name='t1' AND index_name='primary';
SELECT * FROM mysql.index_stats;
db_name	table_name	index_name	prefix_arity	avg_frequency
test	t1	idx2	1	7.0000
test	t1	idx2	2	2.3846
test	t1	idx4	1	6.2000
test	t1	idx4	2	1.6875
test	t1	idx4	3	1.1304
ANALYZE TABLE t1 PERSISTENT FOR COLUMNS() INDEXES(primary);
Table	Op	Msg_type	Msg_text
test.t1	analyze	status	Engine-independent statistics collected
test.t1	analyze	status	Table is already up to date
SELECT * FROM mysql.index_stats;
db_name	table_name	index_name	prefix_arity	avg_frequency
test	t1	PRIMARY	1	1.0000
test	t1	idx2	1	7.0000
test	t1	idx2	2	2.3846
test	t1	idx4	1	6.2000
test	t1	idx4	2	1.6875
test	t1	idx4	3	1.1304
DELETE FROM mysql.table_stats;
DELETE FROM mysql.column_stats;
DELETE FROM mysql.index_stats;
ANALYZE TABLE t1 PERSISTENT FOR COLUMNS ALL INDEXES ALL;
Table	Op	Msg_type	Msg_text
test.t1	analyze	status	Engine-independent statistics collected
test.t1	analyze	status	Table is already up to date
SELECT * FROM mysql.table_stats;
db_name	table_name	cardinality
test	t1	40
SELECT * FROM mysql.column_stats;
db_name	table_name	column_name	min_value	max_value	nulls_ratio	avg_length	avg_frequency	hist_size	hist_type	histogram
test	t1	a	0	49	0.0000	4.0000	1.0000	0	NULL	NULL
test	t1	b	vvvvvvvvvvvvv	zzzzzzzzzzzzzzzzzz	0.2000	17.1250	6.4000	0	NULL	NULL
test	t1	c	aaaa	dddddddd	0.1250	6.6571	7.0000	0	NULL	NULL
test	t1	d	1989-03-12	1999-07-23	0.1500	3.0000	8.5000	0	NULL	NULL
test	t1	e	0.01	0.112	0.2250	8.0000	6.2000	0	NULL	NULL
test	t1	f	1	5	0.2000	1.0000	6.4000	0	NULL	NULL
SELECT * FROM mysql.index_stats;
db_name	table_name	index_name	prefix_arity	avg_frequency
test	t1	PRIMARY	1	1.0000
test	t1	idx1	1	6.4000
test	t1	idx1	2	1.6875
test	t1	idx2	1	7.0000
test	t1	idx2	2	2.3846
test	t1	idx3	1	8.5000
test	t1	idx4	1	6.2000
test	t1	idx4	2	1.6875
test	t1	idx4	3	1.1304
CREATE TABLE t2 LIKE t1;
ALTER TABLE t2 ENGINE=InnoDB;
INSERT INTO t2 SELECT * FROM t1;
set optimizer_switch='extended_keys=off';
ANALYZE TABLE t2;
Table	Op	Msg_type	Msg_text
test.t2	analyze	status	Engine-independent statistics collected
test.t2	analyze	status	OK
SELECT * FROM mysql.table_stats;
db_name	table_name	cardinality
test	t1	40
test	t2	40
SELECT * FROM mysql.column_stats ORDER BY column_name, table_name;
db_name	table_name	column_name	min_value	max_value	nulls_ratio	avg_length	avg_frequency	hist_size	hist_type	histogram
test	t1	a	0	49	0.0000	4.0000	1.0000	0	NULL	NULL
test	t2	a	0	49	0.0000	4.0000	1.0000	0	NULL	NULL
test	t1	b	vvvvvvvvvvvvv	zzzzzzzzzzzzzzzzzz	0.2000	17.1250	6.4000	0	NULL	NULL
test	t2	b	vvvvvvvvvvvvv	zzzzzzzzzzzzzzzzzz	0.2000	17.1250	6.4000	0	NULL	NULL
test	t1	c	aaaa	dddddddd	0.1250	6.6571	7.0000	0	NULL	NULL
test	t2	c	aaaa	dddddddd	0.1250	6.6571	7.0000	0	NULL	NULL
test	t1	d	1989-03-12	1999-07-23	0.1500	3.0000	8.5000	0	NULL	NULL
test	t2	d	1989-03-12	1999-07-23	0.1500	3.0000	8.5000	0	NULL	NULL
test	t1	e	0.01	0.112	0.2250	8.0000	6.2000	0	NULL	NULL
test	t2	e	0.01	0.112	0.2250	8.0000	6.2000	0	NULL	NULL
test	t1	f	1	5	0.2000	1.0000	6.4000	0	NULL	NULL
test	t2	f	1	5	0.2000	1.0000	6.4000	0	NULL	NULL
SELECT * FROM mysql.index_stats ORDER BY index_name, prefix_arity, table_name;
db_name	table_name	index_name	prefix_arity	avg_frequency
test	t1	PRIMARY	1	1.0000
test	t2	PRIMARY	1	1.0000
test	t1	idx1	1	6.4000
test	t2	idx1	1	6.4000
test	t1	idx1	2	1.6875
test	t2	idx1	2	1.6875
test	t1	idx2	1	7.0000
test	t2	idx2	1	7.0000
test	t1	idx2	2	2.3846
test	t2	idx2	2	2.3846
test	t1	idx3	1	8.5000
test	t2	idx3	1	8.5000
test	t1	idx4	1	6.2000
test	t2	idx4	1	6.2000
test	t1	idx4	2	1.6875
test	t2	idx4	2	1.6875
test	t1	idx4	3	1.1304
test	t2	idx4	3	1.1304
DELETE FROM mysql.table_stats;
DELETE FROM mysql.column_stats;
DELETE FROM mysql.index_stats;
set optimizer_switch='extended_keys=on';
ANALYZE TABLE t2;
Table	Op	Msg_type	Msg_text
test.t2	analyze	status	Engine-independent statistics collected
test.t2	analyze	status	OK
SELECT * FROM mysql.table_stats;
db_name	table_name	cardinality
test	t2	40
SELECT * FROM mysql.column_stats ORDER BY column_name;
db_name	table_name	column_name	min_value	max_value	nulls_ratio	avg_length	avg_frequency	hist_size	hist_type	histogram
test	t2	a	0	49	0.0000	4.0000	1.0000	0	NULL	NULL
test	t2	b	vvvvvvvvvvvvv	zzzzzzzzzzzzzzzzzz	0.2000	17.1250	6.4000	0	NULL	NULL
test	t2	c	aaaa	dddddddd	0.1250	6.6571	7.0000	0	NULL	NULL
test	t2	d	1989-03-12	1999-07-23	0.1500	3.0000	8.5000	0	NULL	NULL
test	t2	e	0.01	0.112	0.2250	8.0000	6.2000	0	NULL	NULL
test	t2	f	1	5	0.2000	1.0000	6.4000	0	NULL	NULL
SELECT * FROM mysql.index_stats ORDER BY index_name, prefix_arity, table_name;
db_name	table_name	index_name	prefix_arity	avg_frequency
test	t2	PRIMARY	1	1.0000
test	t2	idx1	1	6.4000
test	t2	idx1	2	1.6875
test	t2	idx1	3	1.0000
test	t2	idx2	1	7.0000
test	t2	idx2	2	2.3846
test	t2	idx2	3	1.0000
test	t2	idx3	1	8.5000
test	t2	idx3	2	1.0000
test	t2	idx4	1	6.2000
test	t2	idx4	2	1.6875
test	t2	idx4	3	1.1304
test	t2	idx4	4	1.0000
ALTER TABLE t2 DROP PRIMARY KEY, DROP INDEX idx1;
SELECT * FROM mysql.index_stats ORDER BY index_name, prefix_arity, table_name;
db_name	table_name	index_name	prefix_arity	avg_frequency
test	t2	idx2	1	7.0000
test	t2	idx2	2	2.3846
test	t2	idx3	1	8.5000
test	t2	idx4	1	6.2000
test	t2	idx4	2	1.6875
test	t2	idx4	3	1.1304
UPDATE t2 SET b=0 WHERE b IS NULL;
ALTER TABLE t2 ADD PRIMARY KEY (a,b);
SELECT * FROM mysql.index_stats ORDER BY index_name, prefix_arity, table_name;
db_name	table_name	index_name	prefix_arity	avg_frequency
test	t2	idx2	1	7.0000
test	t2	idx2	2	2.3846
test	t2	idx3	1	8.5000
test	t2	idx4	1	6.2000
test	t2	idx4	2	1.6875
test	t2	idx4	3	1.1304
ANALYZE TABLE t2 PERSISTENT FOR COLUMNS() INDEXES ALL;
Table	Op	Msg_type	Msg_text
test.t2	analyze	status	Engine-independent statistics collected
test.t2	analyze	status	OK
SELECT * FROM mysql.index_stats ORDER BY index_name, prefix_arity, table_name;
db_name	table_name	index_name	prefix_arity	avg_frequency
test	t2	PRIMARY	1	1.0000
test	t2	PRIMARY	2	1.0000
test	t2	idx2	1	7.0000
test	t2	idx2	2	2.3846
test	t2	idx2	3	1.0000
test	t2	idx2	4	1.0000
test	t2	idx3	1	8.5000
test	t2	idx3	2	1.0000
test	t2	idx3	3	1.0000
test	t2	idx4	1	6.2000
test	t2	idx4	2	1.7222
test	t2	idx4	3	1.1154
test	t2	idx4	4	1.0000
ALTER TABLE t2 CHANGE COLUMN b b varchar(30);
SELECT * FROM mysql.index_stats ORDER BY index_name, prefix_arity, table_name;
db_name	table_name	index_name	prefix_arity	avg_frequency
test	t2	idx2	1	7.0000
test	t2	idx2	2	2.3846
test	t2	idx3	1	8.5000
ANALYZE TABLE t2 PERSISTENT FOR COLUMNS ALL INDEXES ALL;
Table	Op	Msg_type	Msg_text
test.t2	analyze	status	Engine-independent statistics collected
test.t2	analyze	status	OK
SELECT * FROM mysql.index_stats ORDER BY index_name, prefix_arity, table_name;
db_name	table_name	index_name	prefix_arity	avg_frequency
test	t2	PRIMARY	1	1.0000
test	t2	PRIMARY	2	1.0000
test	t2	idx2	1	7.0000
test	t2	idx2	2	2.3846
test	t2	idx2	3	1.0000
test	t2	idx2	4	1.0000
test	t2	idx3	1	8.5000
test	t2	idx3	2	1.0000
test	t2	idx3	3	1.0000
test	t2	idx4	1	6.2000
test	t2	idx4	2	1.7222
test	t2	idx4	3	1.1154
test	t2	idx4	4	1.0000
ALTER TABLE t2 CHANGE COLUMN b b varchar(32);
SELECT * FROM mysql.index_stats ORDER BY index_name, prefix_arity, table_name;
db_name	table_name	index_name	prefix_arity	avg_frequency
test	t2	PRIMARY	1	1.0000
test	t2	PRIMARY	2	1.0000
test	t2	idx2	1	7.0000
test	t2	idx2	2	2.3846
test	t2	idx2	3	1.0000
test	t2	idx2	4	1.0000
test	t2	idx3	1	8.5000
test	t2	idx3	2	1.0000
test	t2	idx3	3	1.0000
test	t2	idx4	1	6.2000
test	t2	idx4	2	1.7222
test	t2	idx4	3	1.1154
test	t2	idx4	4	1.0000
ANALYZE TABLE t2 PERSISTENT FOR COLUMNS ALL INDEXES ALL;
Table	Op	Msg_type	Msg_text
test.t2	analyze	status	Engine-independent statistics collected
test.t2	analyze	status	OK
SELECT * FROM mysql.index_stats ORDER BY index_name, prefix_arity, table_name;
db_name	table_name	index_name	prefix_arity	avg_frequency
test	t2	PRIMARY	1	1.0000
test	t2	PRIMARY	2	1.0000
test	t2	idx2	1	7.0000
test	t2	idx2	2	2.3846
test	t2	idx2	3	1.0000
test	t2	idx2	4	1.0000
test	t2	idx3	1	8.5000
test	t2	idx3	2	1.0000
test	t2	idx3	3	1.0000
test	t2	idx4	1	6.2000
test	t2	idx4	2	1.7222
test	t2	idx4	3	1.1154
test	t2	idx4	4	1.0000
ALTER TABLE t2 DROP COLUMN b, DROP PRIMARY KEY, ADD PRIMARY KEY(a);
SELECT * FROM mysql.index_stats ORDER BY index_name, prefix_arity, table_name;
db_name	table_name	index_name	prefix_arity	avg_frequency
test	t2	idx2	1	7.0000
test	t2	idx2	2	2.3846
test	t2	idx3	1	8.5000
ANALYZE TABLE t2 PERSISTENT FOR COLUMNS() INDEXES ALL;
Table	Op	Msg_type	Msg_text
test.t2	analyze	status	Engine-independent statistics collected
test.t2	analyze	status	OK
SELECT * FROM mysql.index_stats ORDER BY index_name, prefix_arity, table_name;
db_name	table_name	index_name	prefix_arity	avg_frequency
test	t2	PRIMARY	1	1.0000
test	t2	idx2	1	7.0000
test	t2	idx2	2	2.3846
test	t2	idx2	3	1.0000
test	t2	idx3	1	8.5000
test	t2	idx3	2	1.0000
test	t2	idx4	1	6.2000
test	t2	idx4	2	2.2308
test	t2	idx4	3	1.0000
set optimizer_switch='extended_keys=off';
ALTER TABLE t1
DROP INDEX idx1,
DROP INDEX idx4;
ALTER TABLE t1
MODIFY COLUMN b text,
ADD INDEX idx1 (b(4), e), 
ADD INDEX idx4 (e, b(4), d);
SELECT * FROM mysql.column_stats;
db_name	table_name	column_name	min_value	max_value	nulls_ratio	avg_length	avg_frequency	hist_size	hist_type	histogram
test	t2	a	0	49	0.0000	4.0000	1.0000	0	NULL	NULL
test	t2	c	aaaa	dddddddd	0.1250	6.6571	7.0000	0	NULL	NULL
test	t2	d	1989-03-12	1999-07-23	0.1500	3.0000	8.5000	0	NULL	NULL
test	t2	e	0.01	0.112	0.2250	8.0000	6.2000	0	NULL	NULL
test	t2	f	1	5	0.2000	1.0000	6.4000	0	NULL	NULL
SELECT * FROM mysql.index_stats;
db_name	table_name	index_name	prefix_arity	avg_frequency
test	t2	PRIMARY	1	1.0000
test	t2	idx2	1	7.0000
test	t2	idx2	2	2.3846
test	t2	idx2	3	1.0000
test	t2	idx3	1	8.5000
test	t2	idx3	2	1.0000
test	t2	idx4	1	6.2000
test	t2	idx4	2	2.2308
test	t2	idx4	3	1.0000
ANALYZE TABLE t1;
Table	Op	Msg_type	Msg_text
test.t1	analyze	status	Engine-independent statistics collected
test.t1	analyze	Warning	Engine-independent statistics are not collected for column 'b'
test.t1	analyze	status	OK
SELECT * FROM mysql.column_stats;
db_name	table_name	column_name	min_value	max_value	nulls_ratio	avg_length	avg_frequency	hist_size	hist_type	histogram
test	t1	a	0	49	0.0000	4.0000	1.0000	0	NULL	NULL
test	t1	c	aaaa	dddddddd	0.1250	6.6571	7.0000	0	NULL	NULL
test	t1	d	1989-03-12	1999-07-23	0.1500	3.0000	8.5000	0	NULL	NULL
test	t1	e	0.01	0.112	0.2250	8.0000	6.2000	0	NULL	NULL
test	t1	f	1	5	0.2000	1.0000	6.4000	0	NULL	NULL
test	t2	a	0	49	0.0000	4.0000	1.0000	0	NULL	NULL
test	t2	c	aaaa	dddddddd	0.1250	6.6571	7.0000	0	NULL	NULL
test	t2	d	1989-03-12	1999-07-23	0.1500	3.0000	8.5000	0	NULL	NULL
test	t2	e	0.01	0.112	0.2250	8.0000	6.2000	0	NULL	NULL
test	t2	f	1	5	0.2000	1.0000	6.4000	0	NULL	NULL
SELECT * FROM mysql.index_stats;
db_name	table_name	index_name	prefix_arity	avg_frequency
test	t1	PRIMARY	1	1.0000
test	t1	idx1	1	NULL
test	t1	idx1	2	NULL
test	t1	idx2	1	7.0000
test	t1	idx2	2	2.3846
test	t1	idx3	1	8.5000
test	t1	idx4	1	6.2000
test	t1	idx4	2	NULL
test	t1	idx4	3	NULL
test	t2	PRIMARY	1	1.0000
test	t2	idx2	1	7.0000
test	t2	idx2	2	2.3846
test	t2	idx2	3	1.0000
test	t2	idx3	1	8.5000
test	t2	idx3	2	1.0000
test	t2	idx4	1	6.2000
test	t2	idx4	2	2.2308
test	t2	idx4	3	1.0000
DELETE FROM mysql.table_stats;
DELETE FROM mysql.column_stats;
DELETE FROM mysql.index_stats;
ANALYZE TABLE mysql.column_stats PERSISTENT FOR ALL;
Table	Op	Msg_type	Msg_text
mysql.column_stats	analyze	error	Invalid argument
ANALYZE TABLE mysql.column_stats;
Table	Op	Msg_type	Msg_text
mysql.column_stats	analyze	status	OK
SELECT * FROM mysql.table_stats;
db_name	table_name	cardinality
SELECT * FROM mysql.column_stats;
db_name	table_name	column_name	min_value	max_value	nulls_ratio	avg_length	avg_frequency	hist_size	hist_type	histogram
SELECT * FROM mysql.index_stats;
db_name	table_name	index_name	prefix_arity	avg_frequency
set use_stat_tables='never';
ANALYZE TABLE t1 PERSISTENT FOR ALL;
Table	Op	Msg_type	Msg_text
test.t1	analyze	status	Engine-independent statistics collected
test.t1	analyze	Warning	Engine-independent statistics are not collected for column 'b'
test.t1	analyze	status	Table is already up to date
SELECT * FROM mysql.table_stats;
db_name	table_name	cardinality
test	t1	40
SELECT * FROM mysql.column_stats;
db_name	table_name	column_name	min_value	max_value	nulls_ratio	avg_length	avg_frequency	hist_size	hist_type	histogram
test	t1	a	0	49	0.0000	4.0000	1.0000	0	NULL	NULL
test	t1	c	aaaa	dddddddd	0.1250	6.6571	7.0000	0	NULL	NULL
test	t1	d	1989-03-12	1999-07-23	0.1500	3.0000	8.5000	0	NULL	NULL
test	t1	e	0.01	0.112	0.2250	8.0000	6.2000	0	NULL	NULL
test	t1	f	1	5	0.2000	1.0000	6.4000	0	NULL	NULL
SELECT * FROM mysql.index_stats;
db_name	table_name	index_name	prefix_arity	avg_frequency
test	t1	PRIMARY	1	1.0000
test	t1	idx1	1	NULL
test	t1	idx1	2	NULL
test	t1	idx2	1	7.0000
test	t1	idx2	2	2.3846
test	t1	idx3	1	8.5000
test	t1	idx4	1	6.2000
test	t1	idx4	2	NULL
test	t1	idx4	3	NULL
DELETE FROM mysql.table_stats;
DELETE FROM mysql.column_stats;
DELETE FROM mysql.index_stats;
ANALYZE TABLE t1 PERSISTENT FOR COLUMNS(b) INDEXES();
Table	Op	Msg_type	Msg_text
test.t1	analyze	status	Engine-independent statistics collected
test.t1	analyze	Warning	Engine-independent statistics are not collected for column 'b'
test.t1	analyze	status	Table is already up to date
ANALYZE TABLE t1 PERSISTENT FOR columns(a,b) INDEXES();
Table	Op	Msg_type	Msg_text
test.t1	analyze	status	Engine-independent statistics collected
test.t1	analyze	Warning	Engine-independent statistics are not collected for column 'b'
test.t1	analyze	status	Table is already up to date
ANALYZE TABLE t1 PERSISTENT FOR columns(b) indexes(idx2);
Table	Op	Msg_type	Msg_text
test.t1	analyze	status	Engine-independent statistics collected
test.t1	analyze	Warning	Engine-independent statistics are not collected for column 'b'
test.t1	analyze	status	Table is already up to date
ANALYZE TABLE t1 PERSISTENT FOR columns() indexes(idx2);
Table	Op	Msg_type	Msg_text
test.t1	analyze	status	Engine-independent statistics collected
test.t1	analyze	status	Table is already up to date
DELETE FROM mysql.table_stats;
DELETE FROM mysql.column_stats;
DELETE FROM mysql.index_stats;
DROP TABLE t1,t2;
set names utf8;
CREATE DATABASE world;
use world;
CREATE TABLE Country (
Code char(3) NOT NULL default '',
Name char(52) NOT NULL default '',
SurfaceArea float(10,2) NOT NULL default '0.00',
Population int(11) NOT NULL default '0',
Capital int(11) default NULL,
PRIMARY KEY  (Code),
UNIQUE INDEX (Name)
) CHARACTER SET utf8 COLLATE utf8_bin;
CREATE TABLE City (
ID int(11) NOT NULL auto_increment,
Name char(35) NOT NULL default '',
Country char(3) NOT NULL default '',
Population int(11) NOT NULL default '0',
PRIMARY KEY  (ID),
INDEX (Population),
INDEX (Country) 
) CHARACTER SET utf8 COLLATE utf8_bin;
CREATE TABLE CountryLanguage (
Country char(3) NOT NULL default '',
Language char(30) NOT NULL default '',
Percentage float(3,1) NOT NULL default '0.0',
PRIMARY KEY  (Country, Language),
INDEX (Percentage)
) CHARACTER SET utf8 COLLATE utf8_bin;
set use_stat_tables='preferably';
ANALYZE TABLE Country, City, CountryLanguage;
SELECT UPPER(db_name), UPPER(table_name), cardinality
FROM mysql.table_stats;
UPPER(db_name)	UPPER(table_name)	cardinality
WORLD	CITY	4079
WORLD	COUNTRY	239
WORLD	COUNTRYLANGUAGE	984
SELECT UPPER(db_name), UPPER(table_name), 
column_name, min_value, max_value, nulls_ratio, avg_length, avg_frequency
FROM mysql.column_stats;
UPPER(db_name)	UPPER(table_name)	column_name	min_value	max_value	nulls_ratio	avg_length	avg_frequency
WORLD	CITY	Country	ABW	ZWE	0.0000	3.0000	17.5819
WORLD	CITY	ID	1	4079	0.0000	4.0000	1.0000
WORLD	CITY	Name	A Coruña (La Coruña)	Ürgenc	0.0000	8.6416	1.0195
WORLD	CITY	Population	42	10500000	0.0000	4.0000	1.0467
WORLD	COUNTRY	Capital	1	4074	0.0293	4.0000	1.0000
WORLD	COUNTRY	Code	ABW	ZWE	0.0000	3.0000	1.0000
WORLD	COUNTRY	Name	Afghanistan	Zimbabwe	0.0000	10.1088	1.0000
WORLD	COUNTRY	Population	0	1277558000	0.0000	4.0000	1.0575
WORLD	COUNTRY	SurfaceArea	0.40	17075400.00	0.0000	4.0000	1.0042
WORLD	COUNTRYLANGUAGE	Country	ABW	ZWE	0.0000	3.0000	4.2232
WORLD	COUNTRYLANGUAGE	Language	Abhyasi	[South]Mande	0.0000	7.1778	2.1532
WORLD	COUNTRYLANGUAGE	Percentage	0.0	99.9	0.0000	4.0000	2.7640
SELECT UPPER(db_name), UPPER(table_name),
index_name, prefix_arity, avg_frequency
FROM mysql.index_stats;
UPPER(db_name)	UPPER(table_name)	index_name	prefix_arity	avg_frequency
WORLD	CITY	Country	1	17.5819
WORLD	CITY	PRIMARY	1	1.0000
WORLD	CITY	Population	1	1.0467
WORLD	COUNTRY	Name	1	1.0000
WORLD	COUNTRY	PRIMARY	1	1.0000
WORLD	COUNTRYLANGUAGE	PRIMARY	1	4.2232
WORLD	COUNTRYLANGUAGE	PRIMARY	2	1.0000
WORLD	COUNTRYLANGUAGE	Percentage	1	2.7640
use test;
set use_stat_tables='never';
CREATE DATABASE world_innodb;
use world_innodb;
CREATE TABLE Country (
Code char(3) NOT NULL default '',
Name char(52) NOT NULL default '',
SurfaceArea float(10,2) NOT NULL default '0.00',
Population int(11) NOT NULL default '0',
Capital int(11) default NULL,
PRIMARY KEY  (Code),
UNIQUE INDEX (Name)
) CHARACTER SET utf8 COLLATE utf8_bin;
CREATE TABLE City (
ID int(11) NOT NULL auto_increment,
Name char(35) NOT NULL default '',
Country char(3) NOT NULL default '',
Population int(11) NOT NULL default '0',
PRIMARY KEY  (ID),
INDEX (Population),
INDEX (Country) 
) CHARACTER SET utf8 COLLATE utf8_bin;
CREATE TABLE CountryLanguage (
Country char(3) NOT NULL default '',
Language char(30) NOT NULL default '',
Percentage float(3,1) NOT NULL default '0.0',
PRIMARY KEY  (Country, Language),
INDEX (Percentage)
) CHARACTER SET utf8 COLLATE utf8_bin;
ALTER TABLE Country ENGINE=InnoDB;
ALTER TABLE City ENGINE=InnoDB;
ALTER TABLE CountryLanguage ENGINE=InnoDB;
set use_stat_tables='preferably';
ANALYZE TABLE Country, City, CountryLanguage;
SELECT UPPER(db_name), UPPER(table_name), cardinality
FROM mysql.table_stats;
UPPER(db_name)	UPPER(table_name)	cardinality
WORLD	CITY	4079
WORLD	COUNTRY	239
WORLD	COUNTRYLANGUAGE	984
WORLD_INNODB	CITY	4079
WORLD_INNODB	COUNTRY	239
WORLD_INNODB	COUNTRYLANGUAGE	984
SELECT UPPER(db_name), UPPER(table_name), 
column_name, min_value, max_value, nulls_ratio, avg_length, avg_frequency
FROM mysql.column_stats;
UPPER(db_name)	UPPER(table_name)	column_name	min_value	max_value	nulls_ratio	avg_length	avg_frequency
WORLD	CITY	Country	ABW	ZWE	0.0000	3.0000	17.5819
WORLD	CITY	ID	1	4079	0.0000	4.0000	1.0000
WORLD	CITY	Name	A Coruña (La Coruña)	Ürgenc	0.0000	8.6416	1.0195
WORLD	CITY	Population	42	10500000	0.0000	4.0000	1.0467
WORLD	COUNTRY	Capital	1	4074	0.0293	4.0000	1.0000
WORLD	COUNTRY	Code	ABW	ZWE	0.0000	3.0000	1.0000
WORLD	COUNTRY	Name	Afghanistan	Zimbabwe	0.0000	10.1088	1.0000
WORLD	COUNTRY	Population	0	1277558000	0.0000	4.0000	1.0575
WORLD	COUNTRY	SurfaceArea	0.40	17075400.00	0.0000	4.0000	1.0042
WORLD	COUNTRYLANGUAGE	Country	ABW	ZWE	0.0000	3.0000	4.2232
WORLD	COUNTRYLANGUAGE	Language	Abhyasi	[South]Mande	0.0000	7.1778	2.1532
WORLD	COUNTRYLANGUAGE	Percentage	0.0	99.9	0.0000	4.0000	2.7640
WORLD_INNODB	CITY	Country	ABW	ZWE	0.0000	3.0000	17.5819
WORLD_INNODB	CITY	ID	1	4079	0.0000	4.0000	1.0000
WORLD_INNODB	CITY	Name	A Coruña (La Coruña)	Ürgenc	0.0000	8.6416	1.0195
WORLD_INNODB	CITY	Population	42	10500000	0.0000	4.0000	1.0467
WORLD_INNODB	COUNTRY	Capital	1	4074	0.0293	4.0000	1.0000
WORLD_INNODB	COUNTRY	Code	ABW	ZWE	0.0000	3.0000	1.0000
WORLD_INNODB	COUNTRY	Name	Afghanistan	Zimbabwe	0.0000	10.1088	1.0000
WORLD_INNODB	COUNTRY	Population	0	1277558000	0.0000	4.0000	1.0575
WORLD_INNODB	COUNTRY	SurfaceArea	0.40	17075400.00	0.0000	4.0000	1.0042
WORLD_INNODB	COUNTRYLANGUAGE	Country	ABW	ZWE	0.0000	3.0000	4.2232
WORLD_INNODB	COUNTRYLANGUAGE	Language	Abhyasi	[South]Mande	0.0000	7.1778	2.1532
WORLD_INNODB	COUNTRYLANGUAGE	Percentage	0.0	99.9	0.0000	4.0000	2.7640
SELECT UPPER(db_name), UPPER(table_name),
index_name, prefix_arity, avg_frequency
FROM mysql.index_stats;
UPPER(db_name)	UPPER(table_name)	index_name	prefix_arity	avg_frequency
WORLD	CITY	Country	1	17.5819
WORLD	CITY	PRIMARY	1	1.0000
WORLD	CITY	Population	1	1.0467
WORLD	COUNTRY	Name	1	1.0000
WORLD	COUNTRY	PRIMARY	1	1.0000
WORLD	COUNTRYLANGUAGE	PRIMARY	1	4.2232
WORLD	COUNTRYLANGUAGE	PRIMARY	2	1.0000
WORLD	COUNTRYLANGUAGE	Percentage	1	2.7640
WORLD_INNODB	CITY	Country	1	17.5819
WORLD_INNODB	CITY	PRIMARY	1	1.0000
WORLD_INNODB	CITY	Population	1	1.0467
WORLD_INNODB	COUNTRY	Name	1	1.0000
WORLD_INNODB	COUNTRY	PRIMARY	1	1.0000
WORLD_INNODB	COUNTRYLANGUAGE	PRIMARY	1	4.2232
WORLD_INNODB	COUNTRYLANGUAGE	PRIMARY	2	1.0000
WORLD_INNODB	COUNTRYLANGUAGE	Percentage	1	2.7640
use world;
set use_stat_tables='preferably';
set histogram_size=100;
set histogram_type=@SINGLE_PREC_TYPE;
ANALYZE TABLE CountryLanguage;
set histogram_size=254;
set histogram_type=@DOUBLE_PREC_TYPE;
ANALYZE TABLE City;
FLUSH TABLES;
select UPPER(db_name),UPPER(table_name),UPPER(column_name),min_value,max_value,nulls_ratio,avg_length,avg_frequency,hist_size,hist_type,hex(histogram),decode_histogram(hist_type,histogram) from mysql.column_stats where UPPER(db_name)='WORLD' and UPPER(table_name)='COUNTRYLANGUAGE' and UPPER(column_name) = 'PERCENTAGE';;
UPPER(db_name)	WORLD
UPPER(table_name)	COUNTRYLANGUAGE
UPPER(column_name)	PERCENTAGE
min_value	0.0
max_value	99.9
nulls_ratio	0.0000
avg_length	4.0000
avg_frequency	2.7640
hist_size	99
hist_type	JSON
hex(histogram)	5B0A202022302E30222C0A202022302E30222C0A202022302E30222C0A202022302E30222C0A202022302E30222C0A202022302E30222C0A202022302E30222C0A202022302E31222C0A202022302E31222C0A202022302E32222C0A202022302E32222C0A202022302E33222C0A202022302E33222C0A202022302E34222C0A202022302E34222C0A202022302E35222C0A202022302E35222C0A202022302E35222C0A202022302E36222C0A202022302E36222C0A202022302E37222C0A202022302E38222C0A202022302E39222C0A202022312E30222C0A202022312E32222C0A202022312E33222C0A202022312E34222C0A202022312E34222C0A202022312E36222C0A202022312E36222C0A202022312E37222C0A202022312E38222C0A202022322E30222C0A202022322E31222C0A202022322E32222C0A202022322E33222C0A202022322E34222C0A202022322E35222C0A202022322E37222C0A202022322E39222C0A202022332E31222C0A202022332E32222C0A202022332E34222C0A202022332E36222C0A202022332E38222C0A202022332E39222C0A202022342E33222C0A202022342E35222C0A202022342E38222C0A202022352E31222C0A202022352E34222C0A202022352E37222C0A202022352E38222C0A202022362E31222C0A202022362E35222C0A202022362E38222C0A202022372E32222C0A202022372E35222C0A202022372E38222C0A202022382E31222C0A202022382E35222C0A202022382E38222C0A202022392E32222C0A202022392E36222C0A20202231302E33222C0A20202231302E39222C0A20202231312E35222C0A20202231322E32222C0A20202231322E39222C0A20202231332E38222C0A20202231342E38222C0A20202231362E32222C0A20202231372E37222C0A20202231392E35222C0A20202232312E31222C0A20202232332E32222C0A20202232362E39222C0A20202233302E30222C0A20202233322E35222C0A20202233342E38222C0A20202234302E37222C0A20202234352E35222C0A20202235302E30222C0A20202235322E34222C0A20202235392E32222C0A20202236342E37222C0A20202237302E36222C0A20202237362E37222C0A20202238312E30222C0A20202238352E36222C0A20202238372E35222C0A20202238392E37222C0A20202239322E30222C0A20202239342E31222C0A20202239352E38222C0A20202239372E32222C0A20202239382E31222C0A20202239392E30222C0A20202239392E39220A5D
decode_histogram(hist_type,histogram)	[
  "0.0",
  "0.0",
  "0.0",
  "0.0",
  "0.0",
  "0.0",
  "0.0",
  "0.1",
  "0.1",
  "0.2",
  "0.2",
  "0.3",
  "0.3",
  "0.4",
  "0.4",
  "0.5",
  "0.5",
  "0.5",
  "0.6",
  "0.6",
  "0.7",
  "0.8",
  "0.9",
  "1.0",
  "1.2",
  "1.3",
  "1.4",
  "1.4",
  "1.6",
  "1.6",
  "1.7",
  "1.8",
  "2.0",
  "2.1",
  "2.2",
  "2.3",
  "2.4",
  "2.5",
  "2.7",
  "2.9",
  "3.1",
  "3.2",
  "3.4",
  "3.6",
  "3.8",
  "3.9",
  "4.3",
  "4.5",
  "4.8",
  "5.1",
  "5.4",
  "5.7",
  "5.8",
  "6.1",
  "6.5",
  "6.8",
  "7.2",
  "7.5",
  "7.8",
  "8.1",
  "8.5",
  "8.8",
  "9.2",
  "9.6",
  "10.3",
  "10.9",
  "11.5",
  "12.2",
  "12.9",
  "13.8",
  "14.8",
  "16.2",
  "17.7",
  "19.5",
  "21.1",
  "23.2",
  "26.9",
  "30.0",
  "32.5",
  "34.8",
  "40.7",
  "45.5",
  "50.0",
  "52.4",
  "59.2",
  "64.7",
  "70.6",
  "76.7",
  "81.0",
  "85.6",
  "87.5",
  "89.7",
  "92.0",
  "94.1",
  "95.8",
  "97.2",
  "98.1",
  "99.0",
  "99.9"
]
select UPPER(db_name),UPPER(table_name),UPPER(column_name),min_value,max_value,nulls_ratio,avg_length,avg_frequency,hist_size,hist_type,hex(histogram),decode_histogram(hist_type,histogram) from mysql.column_stats where UPPER(db_name)='WORLD' and UPPER(table_name)='CITY' and UPPER(column_name) = 'POPULATION';;
UPPER(db_name)	WORLD
UPPER(table_name)	CITY
UPPER(column_name)	POPULATION
min_value	42
max_value	10500000
nulls_ratio	0.0000
avg_length	4.0000
avg_frequency	1.0467
hist_size	254
hist_type	JSON
hex(histogram)	5B0A2020223432222C0A20202231353030222C0A20202235323030222C0A2020223133313534222C0A2020223237303235222C0A2020223531393639222C0A2020223839303633222C0A2020223839343030222C0A2020223839393030222C0A2020223930323232222C0A2020223930363339222C0A2020223931303030222C0A2020223931323133222C0A2020223931373939222C0A2020223932323536222C0A2020223932363030222C0A2020223933303039222C0A2020223933333530222C0A2020223933393030222C0A2020223934323030222C0A2020223934363836222C0A2020223935303030222C0A2020223935343732222C0A2020223936303032222C0A2020223936333438222C0A2020223936383538222C0A2020223937323030222C0A2020223937363332222C0A2020223938313836222C0A2020223938343334222C0A2020223938393438222C0A2020223939343734222C0A2020223939393037222C0A202022313030323233222C0A202022313030363136222C0A202022313031303030222C0A202022313031333039222C0A202022313031373030222C0A202022313032313231222C0A202022313032333732222C0A202022313032373436222C0A202022313033333030222C0A202022313033363030222C0A202022313034313935222C0A202022313034393836222C0A202022313035323837222C0A202022313035383139222C0A202022313036313938222C0A202022313036363332222C0A202022313037313436222C0A202022313037353833222C0A202022313037383331222C0A202022313038333134222C0A202022313038383438222C0A202022313039323437222C0A202022313039363030222C0A202022313130303438222C0A202022313130373030222C0A202022313131343534222C0A202022313132303030222C0A202022313132353830222C0A202022313133323838222C0A202022313134303235222C0A202022313134353836222C0A202022313135313434222C0A202022313135383132222C0A202022313136333030222C0A202022313137303833222C0A202022313137373333222C0A202022313138333236222C0A202022313138393638222C0A202022313139353236222C0A202022313230313031222C0A202022313230373730222C0A202022313231333937222C0A202022313231393034222C0A202022313232353030222C0A202022313233323733222C0A202022313233373030222C0A202022313234303133222C0A202022313234343839222C0A202022313235303730222C0A202022313235363231222C0A202022313236303839222C0A202022313236343735222C0A202022313237313139222C0A202022313237363334222C0A202022313238303739222C0A202022313238393831222C0A202022313239383030222C0A202022313330353737222C0A202022313331333637222C0A202022313332333138222C0A202022313332393731222C0A202022313333353035222C0A202022313333393530222C0A202022313334383335222C0A202022313335393638222C0A202022313336393730222C0A202022313337363437222C0A202022313338323334222C0A202022313339323030222C0A202022313339383532222C0A202022313430383030222C0A202022313431383030222C0A202022313432353030222C0A202022313433353630222C0A202022313434333733222C0A202022313435353432222C0A202022313436343131222C0A202022313437333036222C0A202022313438303036222C0A202022313439303030222C0A202022313439393635222C0A202022313531303030222C0A202022313532333937222C0A202022313533333434222C0A202022313534393736222C0A202022313535373834222C0A202022313537313731222C0A202022313538323438222C0A202022313539353338222C0A202022313631303332222C0A202022313632333030222C0A202022313633383439222C0A202022313634373437222C0A202022313636343637222C0A202022313637343631222C0A202022313639333030222C0A202022313730343238222C0A202022313731353332222C0A202022313732373130222C0A202022313733393737222C0A202022313735303631222C0A202022313736353831222C0A202022313738323030222C0A202022313739323039222C0A202022313830323733222C0A202022313831393030222C0A202022313833313334222C0A202022313834323536222C0A202022313835363339222C0A202022313837303335222C0A202022313838363931222C0A202022313839383835222C0A202022313931333137222C0A202022313933313734222C0A202022313934373834222C0A202022313936303030222C0A202022313937353530222C0A202022313939353634222C0A202022323031323637222C0A202022323032353030222C0A202022323034393730222C0A202022323036333338222C0A202022323038303134222C0A202022323130353430222C0A202022323133303530222C0A202022323135313936222C0A202022323137303139222C0A202022323139313030222C0A202022323231343030222C0A202022323232383834222C0A202022323235353831222C0A202022323238303137222C0A202022323330383932222C0A202022323333393030222C0A202022323337323036222C0A202022323430303030222C0A202022323432303030222C0A202022323434323437222C0A202022323436363432222C0A202022323439323633222C0A202022323533373630222C0A202022323535363137222C0A202022323539343235222C0A202022323632363836222C0A202022323635303030222C0A202022323637393830222C0A202022323730383238222C0A202022323733393030222C0A202022323737353136222C0A202022323831373238222C0A202022323834383436222C0A202022323838313733222C0A202022323932323533222C0A202022323936323236222C0A202022323939383531222C0A202022333032373839222C0A202022333037323937222C0A202022333131393332222C0A202022333135343135222C0A202022333139373236222C0A202022333234363632222C0A202022333238353335222C0A202022333332343731222C0A202022333337373635222C0A202022333431323838222C0A202022333435393334222C0A202022333532333131222C0A202022333536323531222C0A202022333631373437222C0A202022333634393732222C0A202022333730313930222C0A202022333738383130222C0A202022333833303030222C0A202022333930333530222C0A202022333938333030222C0A202022343035393035222C0A202022343135333436222C0A202022343139353138222C0A202022343235373430222C0A202022343333313830222C0A202022343431363439222C0A202022343439383131222C0A202022343539323030222C0A202022343637333735222C0A202022343735313637222C0A202022343832303433222C0A202022343930303030222C0A202022353036313030222C0A202022353137303833222C0A202022353234303036222C0A202022353337333731222C0A202022353631363030222C0A202022353733323732222C0A202022353931313036222C0A202022363039343030222C0A202022363330303733222C0A202022363532383030222C0A202022363730323038222C0A202022373031393237222C0A202022373238303630222C0A202022373630303030222C0A202022373931393236222C0A202022383136333231222C0A202022383730373136222C0A202022393239323730222C0A202022393838303035222C0A20202231303430303030222C0A20202231303935383734222C0A20202231313438393030222C0A20202231323132323332222C0A20202231323931313137222C0A20202231333732383030222C0A20202231353033343531222C0A20202231363734303030222C0A20202231393638343030222C0A20202232313339313235222C0A20202232353539343234222C0A20202232393430363233222C0A20202234303137373333222C0A20202236343634363933222C0A2020223130353030303030220A5D
decode_histogram(hist_type,histogram)	[
  "42",
  "1500",
  "5200",
  "13154",
  "27025",
  "51969",
  "89063",
  "89400",
  "89900",
  "90222",
  "90639",
  "91000",
  "91213",
  "91799",
  "92256",
  "92600",
  "93009",
  "93350",
  "93900",
  "94200",
  "94686",
  "95000",
  "95472",
  "96002",
  "96348",
  "96858",
  "97200",
  "97632",
  "98186",
  "98434",
  "98948",
  "99474",
  "99907",
  "100223",
  "100616",
  "101000",
  "101309",
  "101700",
  "102121",
  "102372",
  "102746",
  "103300",
  "103600",
  "104195",
  "104986",
  "105287",
  "105819",
  "106198",
  "106632",
  "107146",
  "107583",
  "107831",
  "108314",
  "108848",
  "109247",
  "109600",
  "110048",
  "110700",
  "111454",
  "112000",
  "112580",
  "113288",
  "114025",
  "114586",
  "115144",
  "115812",
  "116300",
  "117083",
  "117733",
  "118326",
  "118968",
  "119526",
  "120101",
  "120770",
  "121397",
  "121904",
  "122500",
  "123273",
  "123700",
  "124013",
  "124489",
  "125070",
  "125621",
  "126089",
  "126475",
  "127119",
  "127634",
  "128079",
  "128981",
  "129800",
  "130577",
  "131367",
  "132318",
  "132971",
  "133505",
  "133950",
  "134835",
  "135968",
  "136970",
  "137647",
  "138234",
  "139200",
  "139852",
  "140800",
  "141800",
  "142500",
  "143560",
  "144373",
  "145542",
  "146411",
  "147306",
  "148006",
  "149000",
  "149965",
  "151000",
  "152397",
  "153344",
  "154976",
  "155784",
  "157171",
  "158248",
  "159538",
  "161032",
  "162300",
  "163849",
  "164747",
  "166467",
  "167461",
  "169300",
  "170428",
  "171532",
  "172710",
  "173977",
  "175061",
  "176581",
  "178200",
  "179209",
  "180273",
  "181900",
  "183134",
  "184256",
  "185639",
  "187035",
  "188691",
  "189885",
  "191317",
  "193174",
  "194784",
  "196000",
  "197550",
  "199564",
  "201267",
  "202500",
  "204970",
  "206338",
  "208014",
  "210540",
  "213050",
  "215196",
  "217019",
  "219100",
  "221400",
  "222884",
  "225581",
  "228017",
  "230892",
  "233900",
  "237206",
  "240000",
  "242000",
  "244247",
  "246642",
  "249263",
  "253760",
  "255617",
  "259425",
  "262686",
  "265000",
  "267980",
  "270828",
  "273900",
  "277516",
  "281728",
  "284846",
  "288173",
  "292253",
  "296226",
  "299851",
  "302789",
  "307297",
  "311932",
  "315415",
  "319726",
  "324662",
  "328535",
  "332471",
  "337765",
  "341288",
  "345934",
  "352311",
  "356251",
  "361747",
  "364972",
  "370190",
  "378810",
  "383000",
  "390350",
  "398300",
  "405905",
  "415346",
  "419518",
  "425740",
  "433180",
  "441649",
  "449811",
  "459200",
  "467375",
  "475167",
  "482043",
  "490000",
  "506100",
  "517083",
  "524006",
  "537371",
  "561600",
  "573272",
  "591106",
  "609400",
  "630073",
  "652800",
  "670208",
  "701927",
  "728060",
  "760000",
  "791926",
  "816321",
  "870716",
  "929270",
  "988005",
  "1040000",
  "1095874",
  "1148900",
  "1212232",
  "1291117",
  "1372800",
  "1503451",
  "1674000",
  "1968400",
  "2139125",
  "2559424",
  "2940623",
  "4017733",
  "6464693",
  "10500000"
]
set histogram_type=@SINGLE_PREC_TYPE;
set histogram_size=0;
use test;
DROP DATABASE world;
SELECT UPPER(db_name), UPPER(table_name), cardinality
FROM mysql.table_stats;
UPPER(db_name)	UPPER(table_name)	cardinality
WORLD_INNODB	CITY	4079
WORLD_INNODB	COUNTRY	239
WORLD_INNODB	COUNTRYLANGUAGE	984
SELECT UPPER(db_name), UPPER(table_name), 
column_name, min_value, max_value, nulls_ratio, avg_length, avg_frequency
FROM mysql.column_stats;
UPPER(db_name)	UPPER(table_name)	column_name	min_value	max_value	nulls_ratio	avg_length	avg_frequency
WORLD_INNODB	CITY	Country	ABW	ZWE	0.0000	3.0000	17.5819
WORLD_INNODB	CITY	ID	1	4079	0.0000	4.0000	1.0000
WORLD_INNODB	CITY	Name	A Coruña (La Coruña)	Ürgenc	0.0000	8.6416	1.0195
WORLD_INNODB	CITY	Population	42	10500000	0.0000	4.0000	1.0467
WORLD_INNODB	COUNTRY	Capital	1	4074	0.0293	4.0000	1.0000
WORLD_INNODB	COUNTRY	Code	ABW	ZWE	0.0000	3.0000	1.0000
WORLD_INNODB	COUNTRY	Name	Afghanistan	Zimbabwe	0.0000	10.1088	1.0000
WORLD_INNODB	COUNTRY	Population	0	1277558000	0.0000	4.0000	1.0575
WORLD_INNODB	COUNTRY	SurfaceArea	0.40	17075400.00	0.0000	4.0000	1.0042
WORLD_INNODB	COUNTRYLANGUAGE	Country	ABW	ZWE	0.0000	3.0000	4.2232
WORLD_INNODB	COUNTRYLANGUAGE	Language	Abhyasi	[South]Mande	0.0000	7.1778	2.1532
WORLD_INNODB	COUNTRYLANGUAGE	Percentage	0.0	99.9	0.0000	4.0000	2.7640
SELECT UPPER(db_name), UPPER(table_name),
index_name, prefix_arity, avg_frequency
FROM mysql.index_stats;
UPPER(db_name)	UPPER(table_name)	index_name	prefix_arity	avg_frequency
WORLD_INNODB	CITY	Country	1	17.5819
WORLD_INNODB	CITY	PRIMARY	1	1.0000
WORLD_INNODB	CITY	Population	1	1.0467
WORLD_INNODB	COUNTRY	Name	1	1.0000
WORLD_INNODB	COUNTRY	PRIMARY	1	1.0000
WORLD_INNODB	COUNTRYLANGUAGE	PRIMARY	1	4.2232
WORLD_INNODB	COUNTRYLANGUAGE	PRIMARY	2	1.0000
WORLD_INNODB	COUNTRYLANGUAGE	Percentage	1	2.7640
DROP DATABASE world_innodb;
SELECT UPPER(db_name), UPPER(table_name), cardinality
FROM mysql.table_stats;
UPPER(db_name)	UPPER(table_name)	cardinality
SELECT UPPER(db_name), UPPER(table_name), 
column_name, min_value, max_value, nulls_ratio, avg_length, avg_frequency
FROM mysql.column_stats;
UPPER(db_name)	UPPER(table_name)	column_name	min_value	max_value	nulls_ratio	avg_length	avg_frequency
SELECT UPPER(db_name), UPPER(table_name),
index_name, prefix_arity, avg_frequency
FROM mysql.index_stats;
UPPER(db_name)	UPPER(table_name)	index_name	prefix_arity	avg_frequency
DELETE FROM mysql.table_stats;
DELETE FROM mysql.column_stats;
DELETE FROM mysql.index_stats;
#
# Bug mdev-4357: empty string as a value of the HIST_SIZE column 
#                from mysql.column_stats
#
create table t1 (a int);
insert into t1 values (1),(2),(3);
set histogram_size=10;
analyze table t1  persistent for all;
Table	Op	Msg_type	Msg_text
test.t1	analyze	status	Engine-independent statistics collected
test.t1	analyze	status	OK
select db_name, table_name, column_name,
min_value, max_value,
nulls_ratio, avg_frequency,
hist_size, hist_type, HEX(histogram)
FROM mysql.column_stats;
db_name	table_name	column_name	min_value	max_value	nulls_ratio	avg_frequency	hist_size	hist_type	HEX(histogram)
test	t1	a	1	3	0.0000	1.0000	9	JSON	5B0A20202231222C0A20202231222C0A20202231222C0A20202232222C0A20202232222C0A20202232222C0A20202233222C0A20202233222C0A20202233220A5D
set histogram_size=default;
drop table t1;
#
# Bug mdev-4359: wrong setting of the HIST_SIZE column 
# (see also mdev-4357)         from mysql.column_stats
#
create table t1 ( a int);
insert into t1 values (1),(2),(3),(4),(5);
set histogram_size=10;
set histogram_type=@DOUBLE_PREC_TYPE;
show variables like 'histogram%';
Variable_name	Value
histogram_size	10
histogram_type	JSON
analyze table t1 persistent for all;
Table	Op	Msg_type	Msg_text
test.t1	analyze	status	Engine-independent statistics collected
test.t1	analyze	status	OK
select db_name, table_name, column_name,
min_value, max_value,
nulls_ratio, avg_frequency,
hist_size, hist_type, HEX(histogram)
FROM mysql.column_stats;
db_name	table_name	column_name	min_value	max_value	nulls_ratio	avg_frequency	hist_size	hist_type	HEX(histogram)
test	t1	a	1	5	0.0000	1.0000	9	JSON	5B0A20202231222C0A20202231222C0A20202232222C0A20202232222C0A20202233222C0A20202233222C0A20202234222C0A20202234222C0A20202235220A5D
set histogram_size=0;
set histogram_type=@SINGLE_PREC_TYPE;
drop table t1;
#
# Bug mdev-4369: histogram for a column with many distinct values 
#
CREATE TABLE t1 (id int);
CREATE TABLE t2 (id int);
INSERT INTO t1 (id) VALUES (1), (1), (1),(1);
INSERT INTO t1 (id) SELECT id FROM t1;
INSERT INTO t1 SELECT id+1 FROM t1;
INSERT INTO t1 SELECT id+2 FROM t1;
INSERT INTO t1 SELECT id+4 FROM t1;
INSERT INTO t1 SELECT id+8 FROM t1;
INSERT INTO t1 SELECT id+16 FROM t1;
INSERT INTO t1 SELECT id+32 FROM t1;
INSERT INTO t1 SELECT id+64 FROM t1;
INSERT INTO t1 SELECT id+128 FROM t1;
INSERT INTO t1 SELECT id+256 FROM t1;
INSERT INTO t1 SELECT id+512 FROM t1;
INSERT INTO t2 SELECT id FROM t1 ORDER BY id*rand();
SELECT COUNT(*) FROM t2;
COUNT(*)
8192
SELECT COUNT(DISTINCT id) FROM t2;
COUNT(DISTINCT id)
1024
set @@tmp_table_size=1024*16;
set @@max_heap_table_size=1024*16;
set histogram_size=63;
analyze table t2 persistent for all;
Table	Op	Msg_type	Msg_text
test.t2	analyze	status	Engine-independent statistics collected
test.t2	analyze	status	OK
select db_name, table_name, column_name,
min_value, max_value,
nulls_ratio, avg_frequency,
hist_size, hist_type, HEX(histogram)
FROM mysql.column_stats;
db_name	table_name	column_name	min_value	max_value	nulls_ratio	avg_frequency	hist_size	hist_type	HEX(histogram)
test	t2	id	1	1024	0.0000	8.0000	63	JSON	5B0A20202231222C0A2020223137222C0A2020223334222C0A2020223530222C0A2020223637222C0A2020223833222C0A202022313030222C0A202022313136222C0A202022313333222C0A202022313439222C0A202022313636222C0A202022313832222C0A202022313939222C0A202022323135222C0A202022323332222C0A202022323438222C0A202022323635222C0A202022323831222C0A202022323938222C0A202022333134222C0A202022333331222C0A202022333437222C0A202022333634222C0A202022333830222C0A202022333937222C0A202022343133222C0A202022343330222C0A202022343436222C0A202022343633222C0A202022343739222C0A202022343936222C0A202022353133222C0A202022353239222C0A202022353436222C0A202022353632222C0A202022353739222C0A202022353935222C0A202022363132222C0A202022363238222C0A202022363435222C0A202022363631222C0A202022363738222C0A202022363934222C0A202022373131222C0A202022373237222C0A202022373434222C0A202022373630222C0A202022373737222C0A202022373933222C0A202022383130222C0A202022383236222C0A202022383433222C0A202022383539222C0A202022383736222C0A202022383932222C0A202022393039222C0A202022393235222C0A202022393432222C0A202022393538222C0A202022393735222C0A202022393931222C0A20202231303038222C0A20202231303234220A5D
set histogram_size=0;
drop table t1, t2;
set use_stat_tables=@save_use_stat_tables;
#
# Bug MDEV-7383: min/max value for a column not utf8 compatible
#
create table t1 (a varchar(100)) engine=MyISAM;
insert into t1 values(unhex('D879626AF872675F73E662F8'));
analyze table t1 persistent for all;
Table	Op	Msg_type	Msg_text
test.t1	analyze	status	Engine-independent statistics collected
test.t1	analyze	status	OK
show warnings;
Level	Code	Message
select db_name, table_name, column_name,
HEX(min_value), HEX(max_value),
nulls_ratio, avg_frequency,
hist_size, hist_type, HEX(histogram)
FROM mysql.column_stats;
db_name	table_name	column_name	HEX(min_value)	HEX(max_value)	nulls_ratio	avg_frequency	hist_size	hist_type	HEX(histogram)
test	t1	a	D879626AF872675F73E662F8	D879626AF872675F73E662F8	0.0000	1.0000	0	NULL	NULL
drop table t1;
#
# MDEB-9744: session optimizer_use_condition_selectivity=5 causing SQL Error (1918):
# Encountered illegal value '' when converting to DECIMAL
#
set @save_optimizer_use_condition_selectivity= @@optimizer_use_condition_selectivity;
set optimizer_use_condition_selectivity=3, use_stat_tables=preferably;
create table t1 (id int(10),cost decimal(9,2)) engine=innodb;
ANALYZE TABLE t1 PERSISTENT FOR ALL;
Table	Op	Msg_type	Msg_text
test.t1	analyze	status	Engine-independent statistics collected
test.t1	analyze	status	OK
create temporary table t2  (id int);
insert into t2 (id) select id from t1 where cost > 0;
select * from t2;
id
set use_stat_tables=@save_use_stat_tables;
set optimizer_use_condition_selectivity= @save_optimizer_use_condition_selectivity;
drop table t1,t2;
#
# MDEV-16507: statistics for temporary tables should not be used
#
SET
@save_optimizer_use_condition_selectivity= @@optimizer_use_condition_selectivity;
SET @@use_stat_tables = preferably ;
SET @@optimizer_use_condition_selectivity = 4;
CREATE TABLE t1 (
TIMESTAMP TIMESTAMP NOT NULL DEFAULT CURRENT_TIMESTAMP
ON UPDATE CURRENT_TIMESTAMP
);
SET @had_t1_table= @@warning_count != 0;
CREATE TEMPORARY TABLE tmp_t1 LIKE t1;
INSERT INTO tmp_t1 VALUES (now());
INSERT INTO t1 SELECT * FROM tmp_t1 WHERE @had_t1_table=0;
DROP TABLE t1;
SET
use_stat_tables=@save_use_stat_tables;
SET
optimizer_use_condition_selectivity= @save_optimizer_use_condition_selectivity;
# End of 10.0 tests
#
# MDEV-9590: Always print "Engine-independent statistic" warnings and
# might be filtering columns unintentionally from engines
#
set use_stat_tables='NEVER';
create table t1 (test blob);
show variables like 'use_stat_tables';
Variable_name	Value
use_stat_tables	NEVER
analyze table t1;
Table	Op	Msg_type	Msg_text
test.t1	analyze	status	Table is already up to date
drop table t1;
#
# MDEV-10435 crash with bad stat tables
#
set use_stat_tables='preferably';
call mtr.add_suppression("Column count of mysql.table_stats is wrong. Expected 3, found 1. The table is probably corrupted");
rename table mysql.table_stats to test.table_stats;
flush tables;
create table t1 (a int);
rename table t1 to t2, t3 to t4;
ERROR 42S02: Table 'test.t3' doesn't exist
drop table t1;
rename table test.table_stats to mysql.table_stats;
rename table mysql.table_stats to test.table_stats;
create table mysql.table_stats (a int);
flush tables;
create table t1 (a int);
rename table t1 to t2, t3 to t4;
ERROR 42S02: Table 'test.t3' doesn't exist
drop table t1, mysql.table_stats;
rename table test.table_stats to mysql.table_stats;
#
# MDEV-19334: bool is_eits_usable(Field*): Assertion `field->table->stats_is_read' failed.
#
create temporary table t1(a int);
insert into t1 values (1),(2),(3);
set use_stat_tables=preferably;
set @optimizer_use_condition_selectivity= @@optimizer_use_condition_selectivity;
set optimizer_use_condition_selectivity=4;
select * from t1 where a >= 2;
a
2
3
drop table t1;
set @@optimizer_use_condition_selectivity= @save_optimizer_use_condition_selectivity;
set use_stat_tables=@save_use_stat_tables;
#
# Start of 10.2 tests
#
#
# MDEV-10134 Add full support for DEFAULT
#
#
# End of 10.2 tests
#
set histogram_size=@save_histogram_size, histogram_type=@save_hist_type;
#
# Start of 10.4 tests
#
#
# Test analyze_sample_percentage system variable.
#
set @save_use_stat_tables=@@use_stat_tables;
set @save_analyze_sample_percentage=@@analyze_sample_percentage;
set session rand_seed1=42;
set session rand_seed2=62;
set use_stat_tables=PREFERABLY;
set histogram_size=10;
CREATE TABLE t1 (id int);
INSERT INTO t1 (id) VALUES (1), (1), (1), (1), (1), (1), (1);
INSERT INTO t1 (id) SELECT id FROM t1;
INSERT INTO t1 SELECT id+1 FROM t1;
INSERT INTO t1 SELECT id+2 FROM t1;
INSERT INTO t1 SELECT id+4 FROM t1;
INSERT INTO t1 SELECT id+8 FROM t1;
INSERT INTO t1 SELECT id+16 FROM t1;
INSERT INTO t1 SELECT id+32 FROM t1;
INSERT INTO t1 SELECT id+64 FROM t1;
INSERT INTO t1 SELECT id+128 FROM t1;
INSERT INTO t1 SELECT id+256 FROM t1;
INSERT INTO t1 SELECT id+512 FROM t1;
INSERT INTO t1 SELECT id+1024 FROM t1;
INSERT INTO t1 SELECT id+2048 FROM t1;
INSERT INTO t1 SELECT id+4096 FROM t1;
INSERT INTO t1 SELECT id+9192 FROM t1;
#
# This query will should show a full table scan analysis.
#
ANALYZE TABLE t1;
Table	Op	Msg_type	Msg_text
test.t1	analyze	status	Engine-independent statistics collected
test.t1	analyze	status	OK
select table_name, column_name, min_value, max_value, nulls_ratio, avg_length, avg_frequency,
DECODE_HISTOGRAM(hist_type, histogram)
from mysql.column_stats;
table_name	column_name	min_value	max_value	nulls_ratio	avg_length	avg_frequency	DECODE_HISTOGRAM(hist_type, histogram)
t1	id	1	17384	0.0000	4.0000	14.0000	[
  "1",
  "1821",
  "3641",
  "5462",
  "7282",
  "10103",
  "11923",
  "13744",
  "15564",
  "17384"
]
set analyze_sample_percentage=0.1;
#
# This query will show an innacurate avg_frequency value.
#
ANALYZE TABLE t1;
Table	Op	Msg_type	Msg_text
test.t1	analyze	status	Engine-independent statistics collected
test.t1	analyze	status	Table is already up to date
select table_name, column_name, min_value, max_value, nulls_ratio, avg_length, avg_frequency,
DECODE_HISTOGRAM(hist_type, histogram)
from mysql.column_stats;
table_name	column_name	min_value	max_value	nulls_ratio	avg_length	avg_frequency	DECODE_HISTOGRAM(hist_type, histogram)
t1	id	111	17026	0.0000	4.0000	10.4739	[
  "111",
  "1086",
  "2872",
  "4944",
  "6588",
  "9483",
  "11382",
  "13551",
  "14897",
  "17026"
]
#
# This query will show a better avg_frequency value.
#
set analyze_sample_percentage=25;
ANALYZE TABLE t1;
Table	Op	Msg_type	Msg_text
test.t1	analyze	status	Engine-independent statistics collected
test.t1	analyze	status	Table is already up to date
select table_name, column_name, min_value, max_value, nulls_ratio, avg_length, avg_frequency,
DECODE_HISTOGRAM(hist_type, histogram)
from mysql.column_stats;
table_name	column_name	min_value	max_value	nulls_ratio	avg_length	avg_frequency	DECODE_HISTOGRAM(hist_type, histogram)
t1	id	1	17384	0.0000	4.0000	14.0401	[
  "1",
  "1798",
  "3618",
  "5417",
  "7229",
  "10057",
  "11895",
  "13718",
  "15539",
  "17384"
]
set analyze_sample_percentage=0;
#
# Test self adjusting sampling level.
#
ANALYZE TABLE t1;
Table	Op	Msg_type	Msg_text
test.t1	analyze	status	Engine-independent statistics collected
test.t1	analyze	status	Table is already up to date
select table_name, column_name, min_value, max_value, nulls_ratio, avg_length, avg_frequency,
DECODE_HISTOGRAM(hist_type, histogram)
from mysql.column_stats;
table_name	column_name	min_value	max_value	nulls_ratio	avg_length	avg_frequency	DECODE_HISTOGRAM(hist_type, histogram)
t1	id	1	17384	0.0000	4.0000	13.9812	[
  "1",
  "1835",
  "3671",
  "5499",
  "7327",
  "10143",
  "11946",
  "13749",
  "15582",
  "17384"
]
#
# Test record estimation is working properly.
#
select count(*) from t1;
count(*)
229376
explain select * from t1;
id	select_type	table	type	possible_keys	key	key_len	ref	rows	Extra
1	SIMPLE	t1	ALL	NULL	NULL	NULL	NULL	229060	
set analyze_sample_percentage=100;
ANALYZE TABLE t1;
Table	Op	Msg_type	Msg_text
test.t1	analyze	status	Engine-independent statistics collected
test.t1	analyze	status	Table is already up to date
select table_name, column_name, min_value, max_value, nulls_ratio, avg_length, avg_frequency,
DECODE_HISTOGRAM(hist_type, histogram)
from mysql.column_stats;
table_name	column_name	min_value	max_value	nulls_ratio	avg_length	avg_frequency	DECODE_HISTOGRAM(hist_type, histogram)
t1	id	1	17384	0.0000	4.0000	14.0000	[
  "1",
  "1821",
  "3641",
  "5462",
  "7282",
  "10103",
  "11923",
  "13744",
  "15564",
  "17384"
]
explain select * from t1;
id	select_type	table	type	possible_keys	key	key_len	ref	rows	Extra
1	SIMPLE	t1	ALL	NULL	NULL	NULL	NULL	229376	
drop table t1;
set analyze_sample_percentage=@save_analyze_sample_percentage;
set histogram_size=@save_histogram_size;
set use_stat_tables=@save_use_stat_tables;
set @@global.histogram_size=@save_histogram_size;
drop table if exists t1;
set @save_histogram_type=@@histogram_type;
set @save_histogram_size=@@histogram_size;
create table ten(a int primary key);
insert into ten values (0),(1),(2),(3),(4),(5),(6),(7),(8),(9);
set histogram_size=100;
set histogram_type='double_prec_hb';
create table t1_bin (a varchar(255));
insert into t1_bin select concat('a-', a) from ten;
analyze table t1_bin persistent for all;
Table	Op	Msg_type	Msg_text
test.t1_bin	analyze	status	Engine-independent statistics collected
test.t1_bin	analyze	status	OK
select hex(histogram) from mysql.column_stats where table_name='t1_bin';
hex(histogram)
00000000000000000000711C711C711C711C711CE338E338E338E338E33855555555555555555555C671C671C671C671C671388E388E388E388E388EAAAAAAAAAAAAAAAAAAAA1BC71BC71BC71BC71BC78DE38DE38DE38DE38DE3FFFFFFFFFFFFFFFFFFFF
explain extended select * from t1_bin where a between 'a-3a' and 'zzzzzzzzz';
id	select_type	table	type	possible_keys	key	key_len	ref	rows	filtered	Extra
1	SIMPLE	t1_bin	ALL	NULL	NULL	NULL	NULL	10	58.82	Using where
Warnings:
Note	1003	select `test`.`t1_bin`.`a` AS `a` from `test`.`t1_bin` where `test`.`t1_bin`.`a` between 'a-3a' and 'zzzzzzzzz'
analyze select * from t1_bin where a between 'a-3a' and 'zzzzzzzzz';
id	select_type	table	type	possible_keys	key	key_len	ref	rows	r_rows	filtered	r_filtered	Extra
1	SIMPLE	t1_bin	ALL	NULL	NULL	NULL	NULL	10	10.00	58.82	60.00	Using where
set histogram_type=json;
create table t1_json (a varchar(255));
insert into t1_json select concat('a-', a) from ten;
analyze table t1_json persistent for all;
Table	Op	Msg_type	Msg_text
test.t1_json	analyze	status	Engine-independent statistics collected
test.t1_json	analyze	status	OK
select * from mysql.column_stats where table_name='t1_json';
db_name	table_name	column_name	min_value	max_value	nulls_ratio	avg_length	avg_frequency	hist_size	hist_type	histogram
test	t1_json	a	a-0	a-9	0.0000	3.0000	1.0000	99	JSON	[
  "a-0",
  "a-0",
  "a-0",
  "a-0",
  "a-0",
  "a-0",
  "a-0",
  "a-0",
  "a-0",
  "a-0",
  "a-1",
  "a-1",
  "a-1",
  "a-1",
  "a-1",
  "a-1",
  "a-1",
  "a-1",
  "a-1",
  "a-1",
  "a-2",
  "a-2",
  "a-2",
  "a-2",
  "a-2",
  "a-2",
  "a-2",
  "a-2",
  "a-2",
  "a-2",
  "a-3",
  "a-3",
  "a-3",
  "a-3",
  "a-3",
  "a-3",
  "a-3",
  "a-3",
  "a-3",
  "a-3",
  "a-4",
  "a-4",
  "a-4",
  "a-4",
  "a-4",
  "a-4",
  "a-4",
  "a-4",
  "a-4",
  "a-4",
  "a-5",
  "a-5",
  "a-5",
  "a-5",
  "a-5",
  "a-5",
  "a-5",
  "a-5",
  "a-5",
  "a-5",
  "a-6",
  "a-6",
  "a-6",
  "a-6",
  "a-6",
  "a-6",
  "a-6",
  "a-6",
  "a-6",
  "a-6",
  "a-7",
  "a-7",
  "a-7",
  "a-7",
  "a-7",
  "a-7",
  "a-7",
  "a-7",
  "a-7",
  "a-7",
  "a-8",
  "a-8",
  "a-8",
  "a-8",
  "a-8",
  "a-8",
  "a-8",
  "a-8",
  "a-8",
  "a-8",
  "a-9",
  "a-9",
  "a-9",
  "a-9",
  "a-9",
  "a-9",
  "a-9",
  "a-9",
  "a-9"
]
explain extended select * from t1_json where a between 'a-3a' and 'zzzzzzzzz';
id	select_type	table	type	possible_keys	key	key_len	ref	rows	filtered	Extra
1	SIMPLE	t1_json	ALL	NULL	NULL	NULL	NULL	10	60.48	Using where
Warnings:
Note	1003	select `test`.`t1_json`.`a` AS `a` from `test`.`t1_json` where `test`.`t1_json`.`a` between 'a-3a' and 'zzzzzzzzz'
analyze select * from t1_json where a between 'a-3a' and 'zzzzzzzzz';
id	select_type	table	type	possible_keys	key	key_len	ref	rows	r_rows	filtered	r_filtered	Extra
1	SIMPLE	t1_json	ALL	NULL	NULL	NULL	NULL	10	10.00	60.48	60.00	Using where
explain extended select * from t1_json where a < 'b-1a';
id	select_type	table	type	possible_keys	key	key_len	ref	rows	filtered	Extra
1	SIMPLE	t1_json	ALL	NULL	NULL	NULL	NULL	10	100.00	Using where
Warnings:
Note	1003	select `test`.`t1_json`.`a` AS `a` from `test`.`t1_json` where `test`.`t1_json`.`a` < 'b-1a'
analyze select * from t1_json where a > 'zzzzzzzzz';
id	select_type	table	type	possible_keys	key	key_len	ref	rows	r_rows	filtered	r_filtered	Extra
1	SIMPLE	t1_json	ALL	NULL	NULL	NULL	NULL	10	10.00	0.73	0.00	Using where
UPDATE mysql.column_stats SET histogram='["a-1", "a-2", {"a": "b"}, "a-3"]' WHERE table_name='t1_json';
FLUSH TABLES;
explain extended select * from t1_json where a between 'a-3a' and 'zzzzzzzzz';
ERROR HY000: Failed to parse histogram, encountered JSON_TYPE '1'.
create table users (
city varchar(100)
);
set histogram_size=50;
insert into users select 'Moscow' from seq_1_to_99;
insert into users select 'Helsinki' from seq_1_to_2;
set histogram_type=json;
analyze table users persistent for all;
Table	Op	Msg_type	Msg_text
test.users	analyze	status	Engine-independent statistics collected
test.users	analyze	status	OK
explain extended select * from users where city = 'Moscow';
id	select_type	table	type	possible_keys	key	key_len	ref	rows	filtered	Extra
1	SIMPLE	users	ALL	NULL	NULL	NULL	NULL	101	98.04	Using where
Warnings:
Note	1003	select `test`.`users`.`city` AS `city` from `test`.`users` where `test`.`users`.`city` = 'Moscow'
analyze select * from users where city = 'Moscow';
id	select_type	table	type	possible_keys	key	key_len	ref	rows	r_rows	filtered	r_filtered	Extra
1	SIMPLE	users	ALL	NULL	NULL	NULL	NULL	101	101.00	98.04	98.02	Using where
explain extended select * from users where city = 'Helsinki';
id	select_type	table	type	possible_keys	key	key_len	ref	rows	filtered	Extra
1	SIMPLE	users	ALL	NULL	NULL	NULL	NULL	101	2.00	Using where
Warnings:
Note	1003	select `test`.`users`.`city` AS `city` from `test`.`users` where `test`.`users`.`city` = 'Helsinki'
analyze select * from users where city = 'helsinki';
id	select_type	table	type	possible_keys	key	key_len	ref	rows	r_rows	filtered	r_filtered	Extra
1	SIMPLE	users	ALL	NULL	NULL	NULL	NULL	101	101.00	2.00	1.98	Using where
explain extended select * from users where city < 'Lagos';
id	select_type	table	type	possible_keys	key	key_len	ref	rows	filtered	Extra
1	SIMPLE	users	ALL	NULL	NULL	NULL	NULL	101	1.58	Using where
Warnings:
Note	1003	select `test`.`users`.`city` AS `city` from `test`.`users` where `test`.`users`.`city` < 'Lagos'
analyze select * from users where city < 'Lagos';
id	select_type	table	type	possible_keys	key	key_len	ref	rows	r_rows	filtered	r_filtered	Extra
1	SIMPLE	users	ALL	NULL	NULL	NULL	NULL	101	101.00	1.58	1.98	Using where
drop table t1_bin;
drop table t1_json;
drop table users;
DELETE FROM mysql.column_stats;
create schema world;
use world;
set histogram_type='JSON';
set histogram_size=50;
ANALYZE TABLE Country, City, CountryLanguage persistent for all;
SELECT column_name, min_value, max_value, hist_size, hist_type, histogram FROM mysql.column_stats;
column_name	min_value	max_value	hist_size	hist_type	histogram
Code	ABW	ZWE	50	JSON	[
  "ABW",
  "ALB",
  "ARM",
  "AUS",
  "BEN",
  "BHS",
  "BOL",
  "BVT",
  "CHE",
  "CMR",
  "COM",
  "CYM",
  "DMA",
  "EGY",
  "ETH",
  "FRO",
  "GHA",
  "GMB",
  "GRL",
  "HKG",
  "HUN",
  "IRN",
  "JAM",
  "KGZ",
  "KWT",
  "LBY",
  "LTU",
  "MCO",
  "MHL",
  "MNG",
  "MTQ",
  "NAM",
  "NIC",
  "NPL",
  "PAN",
  "PNG",
  "PRY",
  "ROM",
  "SEN",
  "SLB",
  "SPM",
  "SVN",
  "TCA",
  "TKL",
  "TUN",
  "UGA",
  "UZB",
  "VIR",
  "YEM",
  "ZWE"
]
Name	Afghanistan	Zimbabwe	50	JSON	[
  "Afghanistan",
  "Andorra",
  "Argentina",
  "Azerbaijan",
  "Belarus",
  "Bhutan",
  "Brazil",
  "Burundi",
  "Cayman Islands",
  "China",
  "Congo",
  "Cuba",
  "Djibouti",
  "Egypt",
  "Ethiopia",
  "France",
  "Gambia",
  "Gibraltar",
  "Guam",
  "Haiti",
  "Hungary",
  "Iraq",
  "Japan",
  "Kuwait",
  "Lesotho",
  "Lithuania",
  "Malawi",
  "Marshall Islands",
  "Mexico",
  "Montserrat",
  "Nauru",
  "New Zealand",
  "Norfolk Island",
  "Oman",
  "Papua New Guinea",
  "Poland",
  "Russian Federation",
  "Saint Lucia",
  "Sao Tome and Principe",
  "Singapore",
  "South Africa",
  "Sri Lanka",
  "Sweden",
  "Tanzania",
  "Trinidad and Tobago",
  "Tuvalu",
  "United States",
  "Venezuela",
  "Western Sahara",
  "Zimbabwe"
]
SurfaceArea	0.40	17075400.00	50	JSON	[
  "0.40",
  "14.00",
  "36.00",
  "78.00",
  "160.00",
  "236.00",
  "298.00",
  "359.00",
  "442.00",
  "468.00",
  "694.00",
  "964.00",
  "1862.00",
  "3903.00",
  "6257.00",
  "10990.00",
  "13878.00",
  "18274.00",
  "22696.00",
  "27834.00",
  "30355.00",
  "41284.00",
  "48511.00",
  "56785.00",
  "69700.00",
  "78866.00",
  "90000.00",
  "103000.00",
  "112088.00",
  "130000.00",
  "163265.00",
  "196722.00",
  "238391.00",
  "245857.00",
  "283561.00",
  "323250.00",
  "342000.00",
  "438317.00",
  "475442.00",
  "551500.00",
  "622984.00",
  "752618.00",
  "824292.00",
  "1025520.00",
  "1240192.00",
  "1566500.00",
  "2149690.00",
  "2724900.00",
  "9363520.00",
  "17075400.00"
]
Population	0	1277558000	50	JSON	[
  "0",
  "0",
  "1000",
  "2500",
  "11000",
  "19000",
  "32300",
  "56000",
  "71000",
  "83000",
  "114000",
  "168000",
  "217000",
  "286000",
  "395000",
  "453000",
  "617000",
  "817000",
  "1213000",
  "1622000",
  "2124000",
  "2583000",
  "3101000",
  "3520000",
  "3850000",
  "4023000",
  "4629000",
  "5074000",
  "5433000",
  "6217000",
  "7160400",
  "8091800",
  "8861400",
  "9997600",
  "10278100",
  "11168000",
  "11937000",
  "15211000",
  "18112000",
  "21607000",
  "22720000",
  "24170000",
  "30080000",
  "38653600",
  "46844000",
  "59623400",
  "68470000",
  "111506000",
  "170115000",
  "1277558000"
]
Capital	1	4074	50	JSON	[
  "1",
  "35",
  "63",
  "135",
  "150",
  "191",
  "211",
  "549",
  "583",
  "594",
  "716",
  "901",
  "910",
  "921",
  "929",
  "1109",
  "1449",
  "1530",
  "1792",
  "1859",
  "2253",
  "2298",
  "2409",
  "2432",
  "2441",
  "2454",
  "2464",
  "2507",
  "2515",
  "2697",
  "2729",
  "2805",
  "2831",
  "2890",
  "2919",
  "3014",
  "3048",
  "3067",
  "3169",
  "3206",
  "3214",
  "3244",
  "3263",
  "3333",
  "3349",
  "3425",
  "3493",
  "3537",
  "3791",
  "4074"
]
ID	1	4079	50	JSON	[
  "1",
  "84",
  "167",
  "250",
  "333",
  "417",
  "500",
  "583",
  "666",
  "750",
  "833",
  "916",
  "999",
  "1083",
  "1166",
  "1249",
  "1332",
  "1416",
  "1499",
  "1582",
  "1665",
  "1749",
  "1832",
  "1915",
  "1998",
  "2082",
  "2165",
  "2248",
  "2331",
  "2415",
  "2498",
  "2581",
  "2664",
  "2748",
  "2831",
  "2914",
  "2997",
  "3081",
  "3164",
  "3247",
  "3330",
  "3414",
  "3497",
  "3580",
  "3663",
  "3747",
  "3830",
  "3913",
  "3996",
  "4079"
]
Name	A Coruña (La Coruña)	Ürgenc	50	JSON	[
  "A Coruña (La Coruña)",
  "Almetjevsk",
  "Arayat",
  "Balaiha",
  "Bayugan",
  "Binzhou",
  "Brno",
  "Campos dos Goytacazes",
  "Chennai (Madras)",
  "Codó",
  "Daly City",
  "Dortmund",
  "Erzurum",
  "Fukuyama",
  "Gomel",
  "Hagen",
  "Hindupur",
  "Ikare",
  "Izevsk",
  "Jixi",
  "Karaj",
  "Kirov",
  "Kumamoto",
  "Latur",
  "Longjing",
  "Malatya",
  "Matsumoto",
  "Mito",
  "Myingyan",
  "Neftekamsk",
  "Novorossijsk",
  "Ormoc",
  "Pasadena",
  "Pittsburgh",
  "Pultava [Poltava]",
  "Randfontein",
  "Río Bravo",
  "San Jose",
  "Santo Domingo de Guzmán",
  "Shenyang",
  "South Dum Dum",
  "São Bernardo do Campo",
  "Tapachula",
  "Tlajomulco de Zúñiga",
  "Turku [Åbo]",
  "Valledupar",
  "Wardha",
  "Yamaguchi",
  "Zhangjiagang",
  "Ürgenc"
]
Country	ABW	ZWE	50	JSON	[
  "ABW",
  "AUS",
  "BLR",
  "BRA",
  "BRA",
  "BRA",
  "CHE",
  "CHN",
  "CHN",
  "CHN",
  "CHN",
  "COD",
  "DEU",
  "DEU",
  "EGY",
  "FIN",
  "GBR",
  "HND",
  "IDN",
  "IND",
  "IND",
  "IND",
  "IND",
  "IRN",
  "ITA",
  "JPN",
  "JPN",
  "JPN",
  "KOR",
  "MAR",
  "MEX",
  "MEX",
  "MWI",
  "NGA",
  "PAK",
  "PHL",
  "PHL",
  "PRI",
  "RUS",
  "RUS",
  "RUS",
  "SWE",
  "TUR",
  "TZA",
  "USA",
  "USA",
  "USA",
  "USA",
  "VNM",
  "ZWE"
]
Population	42	10500000	50	JSON	[
  "42",
  "61000",
  "90712",
  "92779",
  "94876",
  "97168",
  "99474",
  "101340",
  "103400",
  "106000",
  "108121",
  "110531",
  "114024",
  "117100",
  "120217",
  "123366",
  "125982",
  "128821",
  "132957",
  "137000",
  "141000",
  "146003",
  "150645",
  "156800",
  "163700",
  "170600",
  "177193",
  "183377",
  "190600",
  "199000",
  "207927",
  "219149",
  "231511",
  "245000",
  "261911",
  "277100",
  "295969",
  "315432",
  "337977",
  "362268",
  "393049",
  "431607",
  "473854",
  "524006",
  "616306",
  "741927",
  "950500",
  "1261983",
  "2117500",
  "10500000"
]
Country	ABW	ZWE	50	JSON	[
  "ABW",
  "ALB",
  "ATG",
  "AZE",
  "BFA",
  "BLR",
  "BRN",
  "CAN",
  "CHN",
  "CMR",
  "COK",
  "CXR",
  "DJI",
  "ERI",
  "FIN",
  "FSM",
  "GHA",
  "GNB",
  "GUM",
  "HUN",
  "IND",
  "IRQ",
  "JPN",
  "KEN",
  "KWT",
  "LIE",
  "LVA",
  "MDG",
  "MLI",
  "MNP",
  "MSR",
  "MYT",
  "NGA",
  "NOR",
  "PAK",
  "PHL",
  "PRK",
  "ROM",
  "SDN",
  "SJM",
  "SUR",
  "SYC",
  "THA",
  "TTO",
  "TZA",
  "UKR",
  "UZB",
  "VNM",
  "ZAF",
  "ZWE"
]
Language	Abhyasi	[South]Mande	50	JSON	[
  "Abhyasi",
  "Ami",
  "Arabic",
  "Armenian",
  "Balochi",
  "Belorussian",
  "Bullom-sherbro",
  "Chechen",
  "Chinese",
  "Creole English",
  "Creole French",
  "Dorbet",
  "English",
  "English",
  "English",
  "Fijian",
  "French",
  "Ful",
  "German",
  "Gogo",
  "Hadareb",
  "Hindi",
  "Indian Languages",
  "Japanese",
  "Kazakh",
  "Kongo",
  "Kuy",
  "Luguru",
  "Malagasy",
  "Man",
  "Mayo-kebbi",
  "Monegasque",
  "Newari",
  "Nyanja",
  "Persian",
  "Polynesian Languages",
  "Rakhine",
  "Russian",
  "Samoan",
  "Serbo-Croatian",
  "Slovene",
  "Spanish",
  "Spanish",
  "Tadzhik",
  "Telugu",
  "Tsonga",
  "Turkmenian",
  "Ukrainian",
  "Watyi",
  "[South]Mande"
]
Percentage	0.0	99.9	50	JSON	[
  "0.0",
  "0.0",
  "0.0",
  "0.0",
  "0.1",
  "0.2",
  "0.3",
  "0.4",
  "0.5",
  "0.6",
  "0.7",
  "0.9",
  "1.2",
  "1.4",
  "1.6",
  "1.7",
  "2.0",
  "2.3",
  "2.5",
  "2.8",
  "3.1",
  "3.4",
  "3.8",
  "4.3",
  "4.9",
  "5.5",
  "6.0",
  "6.7",
  "7.4",
  "7.9",
  "8.7",
  "9.4",
  "10.7",
  "12.0",
  "13.7",
  "16.1",
  "18.6",
  "22.7",
  "29.7",
  "34.8",
  "44.6",
  "52.0",
  "64.7",
  "76.7",
  "85.0",
  "89.5",
  "93.6",
  "96.9",
  "99.0",
  "99.9"
]
explain extended select * from Country where 'Code' between 'BBC' and 'GGG';
id	select_type	table	type	possible_keys	key	key_len	ref	rows	filtered	Extra
1	SIMPLE	Country	ALL	NULL	NULL	NULL	NULL	239	100.00	
Warnings:
Note	1003	select `world`.`Country`.`Code` AS `Code`,`world`.`Country`.`Name` AS `Name`,`world`.`Country`.`SurfaceArea` AS `SurfaceArea`,`world`.`Country`.`Population` AS `Population`,`world`.`Country`.`Capital` AS `Capital` from `world`.`Country` where 1
analyze select * from Country where 'Code' between 'BBC' and 'GGG';
id	select_type	table	type	possible_keys	key	key_len	ref	rows	r_rows	filtered	r_filtered	Extra
1	SIMPLE	Country	ALL	NULL	NULL	NULL	NULL	239	239.00	100.00	100.00	
explain extended select * from Country where 'Code' < 'BBC';
id	select_type	table	type	possible_keys	key	key_len	ref	rows	filtered	Extra
1	SIMPLE	NULL	NULL	NULL	NULL	NULL	NULL	NULL	NULL	Impossible WHERE
Warnings:
Note	1003	select `world`.`Country`.`Code` AS `Code`,`world`.`Country`.`Name` AS `Name`,`world`.`Country`.`SurfaceArea` AS `SurfaceArea`,`world`.`Country`.`Population` AS `Population`,`world`.`Country`.`Capital` AS `Capital` from `world`.`Country` where 0
analyze select * from Country where 'Code' < 'BBC';
id	select_type	table	type	possible_keys	key	key_len	ref	rows	r_rows	filtered	r_filtered	Extra
1	SIMPLE	NULL	NULL	NULL	NULL	NULL	NULL	NULL	NULL	NULL	NULL	Impossible WHERE
set histogram_type=@save_histogram_type;
set histogram_size=@save_histogram_size;
DROP SCHEMA world;
